Açude,Data do registro,Volume (%),Volume (m³),Afluência/Defluência (m²),Unnamed: 0,data
Epitácio Pessoa,01/04/1960,90.5,484714735.0,0.0,,1960-04-01
Epitácio Pessoa,01/01/1967,95.9,513613007.0,0.0,,1967-01-01
Epitácio Pessoa,02/01/1967,95.8,513429116.0,-183891.0,,1967-01-02
Epitácio Pessoa,03/01/1967,95.8,513245224.0,-183892.0,,1967-01-03
Epitácio Pessoa,04/01/1967,95.8,513245224.0,0.0,,1967-01-04
Epitácio Pessoa,05/01/1967,95.8,513061333.0,-183891.0,,1967-01-05
Epitácio Pessoa,06/01/1967,95.7,512877441.0,-183892.0,,1967-01-06
Epitácio Pessoa,07/01/1967,95.7,512693549.0,-183892.0,,1967-01-07
Epitácio Pessoa,08/01/1967,95.7,512509658.0,-183891.0,,1967-01-08
Epitácio Pessoa,09/01/1967,95.6,512325766.0,-183892.0,,1967-01-09
Epitácio Pessoa,10/01/1967,95.6,512141875.0,-183891.0,,1967-01-10
Epitácio Pessoa,11/01/1967,95.6,511957983.0,-183892.0,,1967-01-11
Epitácio Pessoa,12/01/1967,95.5,511774091.0,-183892.0,,1967-01-12
Epitácio Pessoa,13/01/1967,95.5,511590200.0,-183891.0,,1967-01-13
Epitácio Pessoa,14/01/1967,95.5,511406308.0,-183892.0,,1967-01-14
Epitácio Pessoa,15/01/1967,95.4,511222417.0,-183891.0,,1967-01-15
Epitácio Pessoa,16/01/1967,95.4,511038525.0,-183892.0,,1967-01-16
Epitácio Pessoa,17/01/1967,95.4,510854633.0,-183892.0,,1967-01-17
Epitácio Pessoa,18/01/1967,95.3,510670742.0,-183891.0,,1967-01-18
Epitácio Pessoa,19/01/1967,95.3,510486850.0,-183892.0,,1967-01-19
Epitácio Pessoa,20/01/1967,95.3,510486850.0,0.0,,1967-01-20
Epitácio Pessoa,21/01/1967,95.3,510302959.0,-183891.0,,1967-01-21
Epitácio Pessoa,22/01/1967,95.2,510119067.0,-183892.0,,1967-01-22
Epitácio Pessoa,23/01/1967,95.2,509935175.0,-183892.0,,1967-01-23
Epitácio Pessoa,24/01/1967,95.2,509751284.0,-183891.0,,1967-01-24
Epitácio Pessoa,25/01/1967,95.2,509751284.0,0.0,,1967-01-25
Epitácio Pessoa,26/01/1967,95.1,509567392.0,-183892.0,,1967-01-26
Epitácio Pessoa,27/01/1967,95.1,509383500.0,-183892.0,,1967-01-27
Epitácio Pessoa,28/01/1967,95.1,509199609.0,-183891.0,,1967-01-28
Epitácio Pessoa,29/01/1967,95.1,509199609.0,0.0,,1967-01-29
Epitácio Pessoa,30/01/1967,95.0,509015717.0,-183892.0,,1967-01-30
Epitácio Pessoa,31/01/1967,95.0,508831826.0,-183891.0,,1967-01-31
Epitácio Pessoa,01/02/1967,95.0,508647934.0,-183892.0,,1967-02-01
Epitácio Pessoa,02/02/1967,95.0,508647934.0,0.0,,1967-02-02
Epitácio Pessoa,03/02/1967,94.9,508464042.0,-183892.0,,1967-02-03
Epitácio Pessoa,04/02/1967,94.9,508280151.0,-183891.0,,1967-02-04
Epitácio Pessoa,05/02/1967,94.9,508096259.0,-183892.0,,1967-02-05
Epitácio Pessoa,06/02/1967,94.8,507912368.0,-183891.0,,1967-02-06
Epitácio Pessoa,07/02/1967,94.8,507728476.0,-183892.0,,1967-02-07
Epitácio Pessoa,08/02/1967,94.8,507728476.0,0.0,,1967-02-08
Epitácio Pessoa,09/02/1967,94.7,507544584.0,-183892.0,,1967-02-09
Epitácio Pessoa,10/02/1967,94.7,507360693.0,-183891.0,,1967-02-10
Epitácio Pessoa,11/02/1967,94.7,507176801.0,-183892.0,,1967-02-11
Epitácio Pessoa,12/02/1967,94.6,506992910.0,-183891.0,,1967-02-12
Epitácio Pessoa,13/02/1967,94.6,506809018.0,-183892.0,,1967-02-13
Epitácio Pessoa,14/02/1967,94.6,506625126.0,-183892.0,,1967-02-14
Epitácio Pessoa,15/02/1967,94.6,506625126.0,0.0,,1967-02-15
Epitácio Pessoa,16/02/1967,94.5,506441235.0,-183891.0,,1967-02-16
Epitácio Pessoa,17/02/1967,94.5,506441235.0,0.0,,1967-02-17
Epitácio Pessoa,18/02/1967,94.5,506257343.0,-183892.0,,1967-02-18
Epitácio Pessoa,19/02/1967,94.5,506073452.0,-183891.0,,1967-02-19
Epitácio Pessoa,20/02/1967,94.5,506073452.0,0.0,,1967-02-20
Epitácio Pessoa,21/02/1967,94.4,505889560.0,-183892.0,,1967-02-21
Epitácio Pessoa,22/02/1967,94.4,505889560.0,0.0,,1967-02-22
Epitácio Pessoa,23/02/1967,94.5,506073452.0,183892.0,,1967-02-23
Epitácio Pessoa,24/02/1967,94.6,506992910.0,919458.0,,1967-02-24
Epitácio Pessoa,25/02/1967,94.8,507912368.0,919458.0,,1967-02-25
Epitácio Pessoa,26/02/1967,95.1,509383500.0,1471132.0,,1967-02-26
Epitácio Pessoa,27/02/1967,95.4,510854633.0,1471133.0,,1967-02-27
Epitácio Pessoa,28/02/1967,95.7,512509658.0,1655025.0,,1967-02-28
Epitácio Pessoa,01/03/1967,95.7,512693549.0,183891.0,,1967-03-01
Epitácio Pessoa,02/03/1967,95.7,512877441.0,183892.0,,1967-03-02
Epitácio Pessoa,03/03/1967,95.7,512693549.0,-183892.0,,1967-03-03
Epitácio Pessoa,04/03/1967,95.7,512877441.0,183892.0,,1967-03-04
Epitácio Pessoa,05/03/1967,95.8,513061333.0,183892.0,,1967-03-05
Epitácio Pessoa,06/03/1967,95.8,513429116.0,367783.0,,1967-03-06
Epitácio Pessoa,07/03/1967,95.9,513980791.0,551675.0,,1967-03-07
Epitácio Pessoa,08/03/1967,95.9,513980791.0,0.0,,1967-03-08
Epitácio Pessoa,09/03/1967,96.1,514900249.0,919458.0,,1967-03-09
Epitácio Pessoa,10/03/1967,96.2,515268032.0,367783.0,,1967-03-10
Epitácio Pessoa,11/03/1967,96.3,515819707.0,551675.0,,1967-03-11
Epitácio Pessoa,12/03/1967,96.6,517290840.0,1471133.0,,1967-03-12
Epitácio Pessoa,13/03/1967,96.9,519313647.0,2022807.0,,1967-03-13
Epitácio Pessoa,14/03/1967,97.0,519865322.0,551675.0,,1967-03-14
Epitácio Pessoa,15/03/1967,97.2,520600888.0,735566.0,,1967-03-15
Epitácio Pessoa,16/03/1967,97.3,520968672.0,367784.0,,1967-03-16
Epitácio Pessoa,17/03/1967,98.4,527037095.0,6068423.0,,1967-03-17
Epitácio Pessoa,18/03/1967,98.9,529795469.0,2758374.0,,1967-03-18
Epitácio Pessoa,19/03/1967,99.2,531450493.0,1655024.0,,1967-03-19
Epitácio Pessoa,20/03/1967,99.5,532737734.0,1287241.0,,1967-03-20
Epitácio Pessoa,21/03/1967,100.0,535680000.0,2942266.0,,1967-03-21
Epitácio Pessoa,22/03/1967,100.0,535680000.0,0.0,,1967-03-22
Epitácio Pessoa,23/03/1967,100.0,535680000.0,0.0,,1967-03-23
Epitácio Pessoa,24/03/1967,100.0,535680000.0,0.0,,1967-03-24
Epitácio Pessoa,25/03/1967,100.0,535680000.0,0.0,,1967-03-25
Epitácio Pessoa,26/03/1967,100.0,535680000.0,0.0,,1967-03-26
Epitácio Pessoa,27/03/1967,100.0,535680000.0,0.0,,1967-03-27
Epitácio Pessoa,28/03/1967,100.0,535680000.0,0.0,,1967-03-28
Epitácio Pessoa,29/03/1967,100.0,535680000.0,0.0,,1967-03-29
Epitácio Pessoa,30/03/1967,100.0,535680000.0,0.0,,1967-03-30
Epitácio Pessoa,31/03/1967,100.0,535680000.0,0.0,,1967-03-31
Epitácio Pessoa,01/04/1967,100.0,535680000.0,0.0,,1967-04-01
Epitácio Pessoa,02/04/1967,100.0,535680000.0,0.0,,1967-04-02
Epitácio Pessoa,03/04/1967,100.0,535680000.0,0.0,,1967-04-03
Epitácio Pessoa,04/04/1967,100.0,535680000.0,0.0,,1967-04-04
Epitácio Pessoa,05/04/1967,100.0,535680000.0,0.0,,1967-04-05
Epitácio Pessoa,06/04/1967,100.0,535680000.0,0.0,,1967-04-06
Epitácio Pessoa,07/04/1967,100.0,535680000.0,0.0,,1967-04-07
Epitácio Pessoa,08/04/1967,100.0,535680000.0,0.0,,1967-04-08
Epitácio Pessoa,09/04/1967,100.0,535680000.0,0.0,,1967-04-09
Epitácio Pessoa,10/04/1967,100.0,535680000.0,0.0,,1967-04-10
Epitácio Pessoa,11/04/1967,100.0,535680000.0,0.0,,1967-04-11
Epitácio Pessoa,12/04/1967,100.0,535680000.0,0.0,,1967-04-12
Epitácio Pessoa,13/04/1967,100.0,535680000.0,0.0,,1967-04-13
Epitácio Pessoa,14/04/1967,100.0,535680000.0,0.0,,1967-04-14
Epitácio Pessoa,15/04/1967,100.0,535680000.0,0.0,,1967-04-15
Epitácio Pessoa,16/04/1967,100.0,535680000.0,0.0,,1967-04-16
Epitácio Pessoa,17/04/1967,100.0,535680000.0,0.0,,1967-04-17
Epitácio Pessoa,18/04/1967,100.0,535680000.0,0.0,,1967-04-18
Epitácio Pessoa,19/04/1967,100.0,535680000.0,0.0,,1967-04-19
Epitácio Pessoa,20/04/1967,100.0,535680000.0,0.0,,1967-04-20
Epitácio Pessoa,21/04/1967,100.0,535680000.0,0.0,,1967-04-21
Epitácio Pessoa,22/04/1967,100.0,535680000.0,0.0,,1967-04-22
Epitácio Pessoa,23/04/1967,100.0,535680000.0,0.0,,1967-04-23
Epitácio Pessoa,24/04/1967,100.0,535680000.0,0.0,,1967-04-24
Epitácio Pessoa,25/04/1967,98.9,529795469.0,-5884531.0,,1967-04-25
Epitácio Pessoa,26/04/1967,100.0,535680000.0,5884531.0,,1967-04-26
Epitácio Pessoa,27/04/1967,100.0,535680000.0,0.0,,1967-04-27
Epitácio Pessoa,28/04/1967,100.0,535680000.0,0.0,,1967-04-28
Epitácio Pessoa,29/04/1967,100.0,535680000.0,0.0,,1967-04-29
Epitácio Pessoa,30/04/1967,100.0,535680000.0,0.0,,1967-04-30
Epitácio Pessoa,01/05/1967,100.0,535680000.0,0.0,,1967-05-01
Epitácio Pessoa,02/05/1967,100.0,535680000.0,0.0,,1967-05-02
Epitácio Pessoa,03/05/1967,100.0,535680000.0,0.0,,1967-05-03
Epitácio Pessoa,04/05/1967,100.0,535680000.0,0.0,,1967-05-04
Epitácio Pessoa,05/05/1967,100.0,535680000.0,0.0,,1967-05-05
Epitácio Pessoa,06/05/1967,100.0,535680000.0,0.0,,1967-05-06
Epitácio Pessoa,07/05/1967,100.0,535680000.0,0.0,,1967-05-07
Epitácio Pessoa,08/05/1967,100.0,535680000.0,0.0,,1967-05-08
Epitácio Pessoa,09/05/1967,100.0,535680000.0,0.0,,1967-05-09
Epitácio Pessoa,10/05/1967,100.0,535680000.0,0.0,,1967-05-10
Epitácio Pessoa,11/05/1967,100.0,535680000.0,0.0,,1967-05-11
Epitácio Pessoa,12/05/1967,100.0,535680000.0,0.0,,1967-05-12
Epitácio Pessoa,13/05/1967,100.0,535680000.0,0.0,,1967-05-13
Epitácio Pessoa,14/05/1967,100.0,535680000.0,0.0,,1967-05-14
Epitácio Pessoa,15/05/1967,100.0,535680000.0,0.0,,1967-05-15
Epitácio Pessoa,16/05/1967,100.0,535680000.0,0.0,,1967-05-16
Epitácio Pessoa,17/05/1967,100.0,535680000.0,0.0,,1967-05-17
Epitácio Pessoa,18/05/1967,100.0,535680000.0,0.0,,1967-05-18
Epitácio Pessoa,19/05/1967,100.0,535680000.0,0.0,,1967-05-19
Epitácio Pessoa,20/05/1967,100.0,535680000.0,0.0,,1967-05-20
Epitácio Pessoa,21/05/1967,100.0,535680000.0,0.0,,1967-05-21
Epitácio Pessoa,22/05/1967,100.0,535680000.0,0.0,,1967-05-22
Epitácio Pessoa,23/05/1967,100.0,535680000.0,0.0,,1967-05-23
Epitácio Pessoa,24/05/1967,100.0,535680000.0,0.0,,1967-05-24
Epitácio Pessoa,25/05/1967,100.0,535680000.0,0.0,,1967-05-25
Epitácio Pessoa,26/05/1967,100.0,535680000.0,0.0,,1967-05-26
Epitácio Pessoa,27/05/1967,100.0,535680000.0,0.0,,1967-05-27
Epitácio Pessoa,28/05/1967,100.0,535680000.0,0.0,,1967-05-28
Epitácio Pessoa,29/05/1967,100.0,535680000.0,0.0,,1967-05-29
Epitácio Pessoa,30/05/1967,100.0,535680000.0,0.0,,1967-05-30
Epitácio Pessoa,31/05/1967,100.0,535680000.0,0.0,,1967-05-31
Epitácio Pessoa,01/06/1967,100.0,535680000.0,0.0,,1967-06-01
Epitácio Pessoa,02/06/1967,100.0,535680000.0,0.0,,1967-06-02
Epitácio Pessoa,03/06/1967,99.6,533657192.0,-2022808.0,,1967-06-03
Epitácio Pessoa,04/06/1967,99.6,533289409.0,-367783.0,,1967-06-04
Epitácio Pessoa,05/06/1967,99.5,533105518.0,-183891.0,,1967-06-05
Epitácio Pessoa,06/06/1967,99.5,532921626.0,-183892.0,,1967-06-06
Epitácio Pessoa,07/06/1967,99.5,532737734.0,-183892.0,,1967-06-07
Epitácio Pessoa,08/06/1967,99.8,534392759.0,1655025.0,,1967-06-08
Epitácio Pessoa,09/06/1967,99.3,532186060.0,-2206699.0,,1967-06-09
Epitácio Pessoa,10/06/1967,99.3,532002168.0,-183892.0,,1967-06-10
Epitácio Pessoa,11/06/1967,99.3,531818276.0,-183892.0,,1967-06-11
Epitácio Pessoa,12/06/1967,99.2,531634385.0,-183891.0,,1967-06-12
Epitácio Pessoa,13/06/1967,99.2,531634385.0,0.0,,1967-06-13
Epitácio Pessoa,14/06/1967,99.2,531450493.0,-183892.0,,1967-06-14
Epitácio Pessoa,15/06/1967,99.2,531266601.0,-183892.0,,1967-06-15
Epitácio Pessoa,16/06/1967,99.2,531266601.0,0.0,,1967-06-16
Epitácio Pessoa,17/06/1967,99.2,531266601.0,0.0,,1967-06-17
Epitácio Pessoa,18/06/1967,99.2,531266601.0,0.0,,1967-06-18
Epitácio Pessoa,19/06/1967,99.1,531082710.0,-183891.0,,1967-06-19
Epitácio Pessoa,20/06/1967,99.1,531082710.0,0.0,,1967-06-20
Epitácio Pessoa,21/06/1967,99.1,531082710.0,0.0,,1967-06-21
Epitácio Pessoa,22/06/1967,99.1,531082710.0,0.0,,1967-06-22
Epitácio Pessoa,23/06/1967,99.1,531082710.0,0.0,,1967-06-23
Epitácio Pessoa,24/06/1967,99.1,530898818.0,-183892.0,,1967-06-24
Epitácio Pessoa,25/06/1967,99.1,530898818.0,0.0,,1967-06-25
Epitácio Pessoa,26/06/1967,99.1,531082710.0,183892.0,,1967-06-26
Epitácio Pessoa,27/06/1967,99.1,530898818.0,-183892.0,,1967-06-27
Epitácio Pessoa,28/06/1967,99.1,531082710.0,183892.0,,1967-06-28
Epitácio Pessoa,29/06/1967,99.1,531082710.0,0.0,,1967-06-29
Epitácio Pessoa,30/06/1967,99.1,531082710.0,0.0,,1967-06-30
Epitácio Pessoa,01/07/1967,99.1,531082710.0,0.0,,1967-07-01
Epitácio Pessoa,02/07/1967,99.1,531082710.0,0.0,,1967-07-02
Epitácio Pessoa,03/07/1967,99.2,531266601.0,183891.0,,1967-07-03
Epitácio Pessoa,04/07/1967,99.2,531450493.0,183892.0,,1967-07-04
Epitácio Pessoa,05/07/1967,99.2,531266601.0,-183892.0,,1967-07-05
Epitácio Pessoa,06/07/1967,99.2,531266601.0,0.0,,1967-07-06
Epitácio Pessoa,07/07/1967,99.2,531266601.0,0.0,,1967-07-07
Epitácio Pessoa,08/07/1967,99.2,531450493.0,183892.0,,1967-07-08
Epitácio Pessoa,09/07/1967,99.2,531450493.0,0.0,,1967-07-09
Epitácio Pessoa,10/07/1967,99.2,531450493.0,0.0,,1967-07-10
Epitácio Pessoa,11/07/1967,99.2,531266601.0,-183892.0,,1967-07-11
Epitácio Pessoa,12/07/1967,99.2,531634385.0,367784.0,,1967-07-12
Epitácio Pessoa,13/07/1967,99.2,531450493.0,-183892.0,,1967-07-13
Epitácio Pessoa,14/07/1967,99.2,531266601.0,-183892.0,,1967-07-14
Epitácio Pessoa,15/07/1967,99.1,531082710.0,-183891.0,,1967-07-15
Epitácio Pessoa,16/07/1967,99.1,530898818.0,-183892.0,,1967-07-16
Epitácio Pessoa,17/07/1967,99.1,530714927.0,-183891.0,,1967-07-17
Epitácio Pessoa,18/07/1967,99.1,530714927.0,0.0,,1967-07-18
Epitácio Pessoa,19/07/1967,99.0,530531035.0,-183892.0,,1967-07-19
Epitácio Pessoa,20/07/1967,99.0,530347143.0,-183892.0,,1967-07-20
Epitácio Pessoa,21/07/1967,99.0,530163252.0,-183891.0,,1967-07-21
Epitácio Pessoa,22/07/1967,98.9,529979360.0,-183892.0,,1967-07-22
Epitácio Pessoa,23/07/1967,98.9,529795469.0,-183891.0,,1967-07-23
Epitácio Pessoa,24/07/1967,98.9,529611577.0,-183892.0,,1967-07-24
Epitácio Pessoa,25/07/1967,98.8,529427685.0,-183892.0,,1967-07-25
Epitácio Pessoa,26/07/1967,98.8,529427685.0,0.0,,1967-07-26
Epitácio Pessoa,27/07/1967,98.8,529243794.0,-183891.0,,1967-07-27
Epitácio Pessoa,28/07/1967,98.8,529427685.0,183891.0,,1967-07-28
Epitácio Pessoa,29/07/1967,98.8,529243794.0,-183891.0,,1967-07-29
Epitácio Pessoa,30/07/1967,98.8,529243794.0,0.0,,1967-07-30
Epitácio Pessoa,31/07/1967,98.8,529059902.0,-183892.0,,1967-07-31
Epitácio Pessoa,01/08/1967,98.8,529243794.0,183892.0,,1967-08-01
Epitácio Pessoa,02/08/1967,98.8,529059902.0,-183892.0,,1967-08-02
Epitácio Pessoa,03/08/1967,98.7,528876011.0,-183891.0,,1967-08-03
Epitácio Pessoa,04/08/1967,98.7,528692119.0,-183892.0,,1967-08-04
Epitácio Pessoa,05/08/1967,98.7,528508227.0,-183892.0,,1967-08-05
Epitácio Pessoa,06/08/1967,98.7,528508227.0,0.0,,1967-08-06
Epitácio Pessoa,07/08/1967,98.7,528508227.0,0.0,,1967-08-07
Epitácio Pessoa,08/08/1967,98.6,528324336.0,-183891.0,,1967-08-08
Epitácio Pessoa,09/08/1967,98.6,528140444.0,-183892.0,,1967-08-09
Epitácio Pessoa,10/08/1967,98.6,527956553.0,-183891.0,,1967-08-10
Epitácio Pessoa,11/08/1967,98.5,527772661.0,-183892.0,,1967-08-11
Epitácio Pessoa,12/08/1967,98.5,527588769.0,-183892.0,,1967-08-12
Epitácio Pessoa,13/08/1967,98.5,527404878.0,-183891.0,,1967-08-13
Epitácio Pessoa,14/08/1967,98.4,527220986.0,-183892.0,,1967-08-14
Epitácio Pessoa,15/08/1967,98.4,527037095.0,-183891.0,,1967-08-15
Epitácio Pessoa,16/08/1967,98.4,527037095.0,0.0,,1967-08-16
Epitácio Pessoa,17/08/1967,98.4,526853203.0,-183892.0,,1967-08-17
Epitácio Pessoa,18/08/1967,98.4,526853203.0,0.0,,1967-08-18
Epitácio Pessoa,19/08/1967,98.4,526853203.0,0.0,,1967-08-19
Epitácio Pessoa,20/08/1967,98.3,526669311.0,-183892.0,,1967-08-20
Epitácio Pessoa,21/08/1967,98.3,526485420.0,-183891.0,,1967-08-21
Epitácio Pessoa,22/08/1967,98.3,526485420.0,0.0,,1967-08-22
Epitácio Pessoa,23/08/1967,98.2,526301528.0,-183892.0,,1967-08-23
Epitácio Pessoa,24/08/1967,98.2,526117637.0,-183891.0,,1967-08-24
Epitácio Pessoa,25/08/1967,98.2,526117637.0,0.0,,1967-08-25
Epitácio Pessoa,26/08/1967,98.2,525933745.0,-183892.0,,1967-08-26
Epitácio Pessoa,27/08/1967,98.1,525749853.0,-183892.0,,1967-08-27
Epitácio Pessoa,28/08/1967,98.1,525565962.0,-183891.0,,1967-08-28
Epitácio Pessoa,29/08/1967,98.1,525382070.0,-183892.0,,1967-08-29
Epitácio Pessoa,30/08/1967,98.0,525198179.0,-183891.0,,1967-08-30
Epitácio Pessoa,31/08/1967,98.0,525014287.0,-183892.0,,1967-08-31
Epitácio Pessoa,01/09/1967,98.0,525014287.0,0.0,,1967-09-01
Epitácio Pessoa,02/09/1967,98.0,524830395.0,-183892.0,,1967-09-02
Epitácio Pessoa,03/09/1967,97.9,524646504.0,-183891.0,,1967-09-03
Epitácio Pessoa,04/09/1967,97.9,524646504.0,0.0,,1967-09-04
Epitácio Pessoa,05/09/1967,97.9,524462612.0,-183892.0,,1967-09-05
Epitácio Pessoa,06/09/1967,97.9,524278720.0,-183892.0,,1967-09-06
Epitácio Pessoa,07/09/1967,97.9,524278720.0,0.0,,1967-09-07
Epitácio Pessoa,08/09/1967,97.8,524094829.0,-183891.0,,1967-09-08
Epitácio Pessoa,09/09/1967,97.8,523910937.0,-183892.0,,1967-09-09
Epitácio Pessoa,10/09/1967,97.8,523727046.0,-183891.0,,1967-09-10
Epitácio Pessoa,11/09/1967,97.7,523543154.0,-183892.0,,1967-09-11
Epitácio Pessoa,12/09/1967,97.7,523359262.0,-183892.0,,1967-09-12
Epitácio Pessoa,13/09/1967,97.7,523359262.0,0.0,,1967-09-13
Epitácio Pessoa,14/09/1967,97.7,523175371.0,-183891.0,,1967-09-14
Epitácio Pessoa,15/09/1967,97.6,522991479.0,-183892.0,,1967-09-15
Epitácio Pessoa,16/09/1967,97.6,522807588.0,-183891.0,,1967-09-16
Epitácio Pessoa,17/09/1967,97.6,522807588.0,0.0,,1967-09-17
Epitácio Pessoa,18/09/1967,97.6,522623696.0,-183892.0,,1967-09-18
Epitácio Pessoa,19/09/1967,97.5,522439804.0,-183892.0,,1967-09-19
Epitácio Pessoa,20/09/1967,97.5,522255913.0,-183891.0,,1967-09-20
Epitácio Pessoa,21/09/1967,97.5,522255913.0,0.0,,1967-09-21
Epitácio Pessoa,22/09/1967,97.5,522072021.0,-183892.0,,1967-09-22
Epitácio Pessoa,23/09/1967,97.4,521888130.0,-183891.0,,1967-09-23
Epitácio Pessoa,24/09/1967,97.4,521704238.0,-183892.0,,1967-09-24
Epitácio Pessoa,25/09/1967,97.4,521520346.0,-183892.0,,1967-09-25
Epitácio Pessoa,26/09/1967,97.3,521336455.0,-183891.0,,1967-09-26
Epitácio Pessoa,27/09/1967,97.3,520968672.0,-367783.0,,1967-09-27
Epitácio Pessoa,28/09/1967,97.2,520784780.0,-183892.0,,1967-09-28
Epitácio Pessoa,29/09/1967,97.2,520600888.0,-183892.0,,1967-09-29
Epitácio Pessoa,01/10/1967,97.2,520600888.0,0.0,,1967-10-01
Epitácio Pessoa,02/10/1967,97.2,520600888.0,0.0,,1967-10-02
Epitácio Pessoa,03/10/1967,97.2,520416997.0,-183891.0,,1967-10-03
Epitácio Pessoa,04/10/1967,97.2,520416997.0,0.0,,1967-10-04
Epitácio Pessoa,05/10/1967,97.1,520233105.0,-183892.0,,1967-10-05
Epitácio Pessoa,06/10/1967,97.1,520233105.0,0.0,,1967-10-06
Epitácio Pessoa,07/10/1967,97.1,520049214.0,-183891.0,,1967-10-07
Epitácio Pessoa,08/10/1967,97.0,519865322.0,-183892.0,,1967-10-08
Epitácio Pessoa,09/10/1967,97.0,519681430.0,-183892.0,,1967-10-09
Epitácio Pessoa,10/10/1967,97.0,519497539.0,-183891.0,,1967-10-10
Epitácio Pessoa,11/10/1967,97.0,519497539.0,0.0,,1967-10-11
Epitácio Pessoa,12/10/1967,96.9,519313647.0,-183892.0,,1967-10-12
Epitácio Pessoa,13/10/1967,96.9,519313647.0,0.0,,1967-10-13
Epitácio Pessoa,14/10/1967,96.9,519129756.0,-183891.0,,1967-10-14
Epitácio Pessoa,15/10/1967,96.9,519129756.0,0.0,,1967-10-15
Epitácio Pessoa,16/10/1967,96.9,518945864.0,-183892.0,,1967-10-16
Epitácio Pessoa,17/10/1967,96.9,518945864.0,0.0,,1967-10-17
Epitácio Pessoa,18/10/1967,96.8,518761972.0,-183892.0,,1967-10-18
Epitácio Pessoa,19/10/1967,96.8,518578081.0,-183891.0,,1967-10-19
Epitácio Pessoa,20/10/1967,96.8,518578081.0,0.0,,1967-10-20
Epitácio Pessoa,21/10/1967,96.8,518394189.0,-183892.0,,1967-10-21
Epitácio Pessoa,22/10/1967,96.7,518210298.0,-183891.0,,1967-10-22
Epitácio Pessoa,23/10/1967,96.7,518026406.0,-183892.0,,1967-10-23
Epitácio Pessoa,24/10/1967,96.7,517842514.0,-183892.0,,1967-10-24
Epitácio Pessoa,25/10/1967,96.7,517842514.0,0.0,,1967-10-25
Epitácio Pessoa,26/10/1967,96.6,517658623.0,-183891.0,,1967-10-26
Epitácio Pessoa,27/10/1967,96.6,517658623.0,0.0,,1967-10-27
Epitácio Pessoa,28/10/1967,96.6,517474731.0,-183892.0,,1967-10-28
Epitácio Pessoa,29/10/1967,96.6,517474731.0,0.0,,1967-10-29
Epitácio Pessoa,30/10/1967,96.6,517290840.0,-183891.0,,1967-10-30
Epitácio Pessoa,31/10/1967,96.6,517290840.0,0.0,,1967-10-31
Epitácio Pessoa,01/11/1967,96.6,517290840.0,0.0,,1967-11-01
Epitácio Pessoa,02/11/1967,96.5,516923056.0,-367784.0,,1967-11-02
Epitácio Pessoa,03/11/1967,96.5,516739165.0,-183891.0,,1967-11-03
Epitácio Pessoa,04/11/1967,96.6,517474731.0,735566.0,,1967-11-04
Epitácio Pessoa,05/11/1967,96.4,516187490.0,-1287241.0,,1967-11-05
Epitácio Pessoa,06/11/1967,96.3,516003598.0,-183892.0,,1967-11-06
Epitácio Pessoa,07/11/1967,96.3,515819707.0,-183891.0,,1967-11-07
Epitácio Pessoa,08/11/1967,96.3,515635815.0,-183892.0,,1967-11-08
Epitácio Pessoa,09/11/1967,92.4,494960861.0,-20674954.0,,1967-11-09
Epitácio Pessoa,10/11/1967,96.2,515268032.0,20307171.0,,1967-11-10
Epitácio Pessoa,11/11/1967,96.2,515084140.0,-183892.0,,1967-11-11
Epitácio Pessoa,12/11/1967,96.1,514900249.0,-183891.0,,1967-11-12
Epitácio Pessoa,13/11/1967,96.1,514716357.0,-183892.0,,1967-11-13
Epitácio Pessoa,14/11/1967,96.1,514532465.0,-183892.0,,1967-11-14
Epitácio Pessoa,15/11/1967,96.0,514348574.0,-183891.0,,1967-11-15
Epitácio Pessoa,16/11/1967,96.0,514164682.0,-183892.0,,1967-11-16
Epitácio Pessoa,17/11/1967,95.9,513980791.0,-183891.0,,1967-11-17
Epitácio Pessoa,18/11/1967,95.9,513796899.0,-183892.0,,1967-11-18
Epitácio Pessoa,19/11/1967,95.8,513429116.0,-367783.0,,1967-11-19
Epitácio Pessoa,20/11/1967,95.8,513245224.0,-183892.0,,1967-11-20
Epitácio Pessoa,21/11/1967,95.8,513061333.0,-183891.0,,1967-11-21
Epitácio Pessoa,22/11/1967,95.7,512877441.0,-183892.0,,1967-11-22
Epitácio Pessoa,23/11/1967,95.7,512693549.0,-183892.0,,1967-11-23
Epitácio Pessoa,24/11/1967,95.7,512509658.0,-183891.0,,1967-11-24
Epitácio Pessoa,25/11/1967,95.6,512325766.0,-183892.0,,1967-11-25
Epitácio Pessoa,26/11/1967,95.6,512141875.0,-183891.0,,1967-11-26
Epitácio Pessoa,27/11/1967,95.6,511957983.0,-183892.0,,1967-11-27
Epitácio Pessoa,28/11/1967,95.5,511774091.0,-183892.0,,1967-11-28
Epitácio Pessoa,29/11/1967,95.5,511590200.0,-183891.0,,1967-11-29
Epitácio Pessoa,30/11/1967,95.5,511406308.0,-183892.0,,1967-11-30
Epitácio Pessoa,01/12/1967,95.5,511406308.0,0.0,,1967-12-01
Epitácio Pessoa,02/12/1967,95.4,511222417.0,-183891.0,,1967-12-02
Epitácio Pessoa,03/12/1967,95.4,511038525.0,-183892.0,,1967-12-03
Epitácio Pessoa,04/12/1967,95.4,510854633.0,-183892.0,,1967-12-04
Epitácio Pessoa,05/12/1967,95.3,510670742.0,-183891.0,,1967-12-05
Epitácio Pessoa,06/12/1967,95.3,510486850.0,-183892.0,,1967-12-06
Epitácio Pessoa,07/12/1967,95.3,510302959.0,-183891.0,,1967-12-07
Epitácio Pessoa,08/12/1967,95.2,510119067.0,-183892.0,,1967-12-08
Epitácio Pessoa,09/12/1967,95.2,509935175.0,-183892.0,,1967-12-09
Epitácio Pessoa,10/12/1967,95.2,509751284.0,-183891.0,,1967-12-10
Epitácio Pessoa,11/12/1967,95.1,509567392.0,-183892.0,,1967-12-11
Epitácio Pessoa,12/12/1967,95.1,509383500.0,-183892.0,,1967-12-12
Epitácio Pessoa,13/12/1967,95.1,509199609.0,-183891.0,,1967-12-13
Epitácio Pessoa,14/12/1967,95.0,509015717.0,-183892.0,,1967-12-14
Epitácio Pessoa,15/12/1967,95.0,508831826.0,-183891.0,,1967-12-15
Epitácio Pessoa,16/12/1967,95.0,508647934.0,-183892.0,,1967-12-16
Epitácio Pessoa,17/12/1967,94.9,508464042.0,-183892.0,,1967-12-17
Epitácio Pessoa,18/12/1967,94.9,508280151.0,-183891.0,,1967-12-18
Epitácio Pessoa,19/12/1967,94.9,508096259.0,-183892.0,,1967-12-19
Epitácio Pessoa,20/12/1967,94.8,507912368.0,-183891.0,,1967-12-20
Epitácio Pessoa,21/12/1967,94.8,507728476.0,-183892.0,,1967-12-21
Epitácio Pessoa,22/12/1967,94.7,507544584.0,-183892.0,,1967-12-22
Epitácio Pessoa,23/12/1967,94.7,507360693.0,-183891.0,,1967-12-23
Epitácio Pessoa,24/12/1967,94.7,507176801.0,-183892.0,,1967-12-24
Epitácio Pessoa,25/12/1967,94.6,506992910.0,-183891.0,,1967-12-25
Epitácio Pessoa,26/12/1967,94.6,506809018.0,-183892.0,,1967-12-26
Epitácio Pessoa,27/12/1967,94.6,506625126.0,-183892.0,,1967-12-27
Epitácio Pessoa,28/12/1967,94.6,506625126.0,0.0,,1967-12-28
Epitácio Pessoa,29/12/1967,94.6,506625126.0,0.0,,1967-12-29
Epitácio Pessoa,30/12/1967,94.6,506625126.0,0.0,,1967-12-30
Epitácio Pessoa,01/01/1968,94.6,506625126.0,0.0,,1968-01-01
Epitácio Pessoa,02/01/1968,94.6,506625126.0,0.0,,1968-01-02
Epitácio Pessoa,03/01/1968,94.5,506441235.0,-183891.0,,1968-01-03
Epitácio Pessoa,04/01/1968,94.5,506441235.0,0.0,,1968-01-04
Epitácio Pessoa,05/01/1968,94.5,506257343.0,-183892.0,,1968-01-05
Epitácio Pessoa,06/01/1968,94.5,506257343.0,0.0,,1968-01-06
Epitácio Pessoa,07/01/1968,94.5,506073452.0,-183891.0,,1968-01-07
Epitácio Pessoa,08/01/1968,94.4,505889560.0,-183892.0,,1968-01-08
Epitácio Pessoa,09/01/1968,94.4,505705668.0,-183892.0,,1968-01-09
Epitácio Pessoa,10/01/1968,94.4,505521777.0,-183891.0,,1968-01-10
Epitácio Pessoa,11/01/1968,94.3,505337885.0,-183892.0,,1968-01-11
Epitácio Pessoa,12/01/1968,94.3,505153994.0,-183891.0,,1968-01-12
Epitácio Pessoa,13/01/1968,94.3,504970102.0,-183892.0,,1968-01-13
Epitácio Pessoa,14/01/1968,94.2,504786210.0,-183892.0,,1968-01-14
Epitácio Pessoa,15/01/1968,94.2,504602319.0,-183891.0,,1968-01-15
Epitácio Pessoa,16/01/1968,94.2,504418427.0,-183892.0,,1968-01-16
Epitácio Pessoa,17/01/1968,94.1,504234536.0,-183891.0,,1968-01-17
Epitácio Pessoa,18/01/1968,94.1,504234536.0,0.0,,1968-01-18
Epitácio Pessoa,19/01/1968,94.1,504050644.0,-183892.0,,1968-01-19
Epitácio Pessoa,20/01/1968,94.1,504050644.0,0.0,,1968-01-20
Epitácio Pessoa,21/01/1968,94.1,503866752.0,-183892.0,,1968-01-21
Epitácio Pessoa,22/01/1968,94.0,503682861.0,-183891.0,,1968-01-22
Epitácio Pessoa,23/01/1968,94.1,503866752.0,183891.0,,1968-01-23
Epitácio Pessoa,24/01/1968,94.1,504050644.0,183892.0,,1968-01-24
Epitácio Pessoa,25/01/1968,94.1,504234536.0,183892.0,,1968-01-25
Epitácio Pessoa,26/01/1968,94.2,504418427.0,183891.0,,1968-01-26
Epitácio Pessoa,27/01/1968,94.2,504602319.0,183892.0,,1968-01-27
Epitácio Pessoa,28/01/1968,94.2,504602319.0,0.0,,1968-01-28
Epitácio Pessoa,29/01/1968,94.2,504786210.0,183891.0,,1968-01-29
Epitácio Pessoa,30/01/1968,94.2,504786210.0,0.0,,1968-01-30
Epitácio Pessoa,31/01/1968,94.3,504970102.0,183892.0,,1968-01-31
Epitácio Pessoa,01/02/1968,94.3,504970102.0,0.0,,1968-02-01
Epitácio Pessoa,02/02/1968,94.2,504786210.0,-183892.0,,1968-02-02
Epitácio Pessoa,03/02/1968,94.2,504602319.0,-183891.0,,1968-02-03
Epitácio Pessoa,04/02/1968,94.2,504418427.0,-183892.0,,1968-02-04
Epitácio Pessoa,05/02/1968,94.1,504234536.0,-183891.0,,1968-02-05
Epitácio Pessoa,06/02/1968,94.1,504050644.0,-183892.0,,1968-02-06
Epitácio Pessoa,07/02/1968,94.1,503866752.0,-183892.0,,1968-02-07
Epitácio Pessoa,08/02/1968,94.0,503682861.0,-183891.0,,1968-02-08
Epitácio Pessoa,09/02/1968,94.0,503498969.0,-183892.0,,1968-02-09
Epitácio Pessoa,10/02/1968,94.0,503315078.0,-183891.0,,1968-02-10
Epitácio Pessoa,11/02/1968,93.9,503131186.0,-183892.0,,1968-02-11
Epitácio Pessoa,12/02/1968,93.9,502947294.0,-183892.0,,1968-02-12
Epitácio Pessoa,13/02/1968,93.9,502763403.0,-183891.0,,1968-02-13
Epitácio Pessoa,14/02/1968,93.8,502579511.0,-183892.0,,1968-02-14
Epitácio Pessoa,15/02/1968,93.8,502395619.0,-183892.0,,1968-02-15
Epitácio Pessoa,16/02/1968,93.8,502211728.0,-183891.0,,1968-02-16
Epitácio Pessoa,17/02/1968,93.7,502027836.0,-183892.0,,1968-02-17
Epitácio Pessoa,18/02/1968,93.7,501843945.0,-183891.0,,1968-02-18
Epitácio Pessoa,19/02/1968,93.6,501660053.0,-183892.0,,1968-02-19
Epitácio Pessoa,20/02/1968,93.6,501660053.0,0.0,,1968-02-20
Epitácio Pessoa,21/02/1968,93.6,501476161.0,-183892.0,,1968-02-21
Epitácio Pessoa,22/02/1968,93.6,501476161.0,0.0,,1968-02-22
Epitácio Pessoa,23/02/1968,93.6,501292270.0,-183891.0,,1968-02-23
Epitácio Pessoa,24/02/1968,93.6,501292270.0,0.0,,1968-02-24
Epitácio Pessoa,25/02/1968,93.5,501108378.0,-183892.0,,1968-02-25
Epitácio Pessoa,26/02/1968,93.5,501108378.0,0.0,,1968-02-26
Epitácio Pessoa,27/02/1968,93.5,500924487.0,-183891.0,,1968-02-27
Epitácio Pessoa,28/02/1968,93.5,500924487.0,0.0,,1968-02-28
Epitácio Pessoa,29/02/1968,93.5,500924487.0,0.0,,1968-02-29
Epitácio Pessoa,01/03/1968,93.5,500924487.0,0.0,,1968-03-01
Epitácio Pessoa,02/03/1968,93.5,500924487.0,0.0,,1968-03-02
Epitácio Pessoa,03/03/1968,93.5,501108378.0,183891.0,,1968-03-03
Epitácio Pessoa,04/03/1968,93.6,501476161.0,367783.0,,1968-03-04
Epitácio Pessoa,05/03/1968,94.0,503498969.0,2022808.0,,1968-03-05
Epitácio Pessoa,06/03/1968,94.0,503498969.0,0.0,,1968-03-06
Epitácio Pessoa,07/03/1968,94.0,503498969.0,0.0,,1968-03-07
Epitácio Pessoa,08/03/1968,94.7,507544584.0,4045615.0,,1968-03-08
Epitácio Pessoa,09/03/1968,95.0,508647934.0,1103350.0,,1968-03-09
Epitácio Pessoa,10/03/1968,96.0,514348574.0,5700640.0,,1968-03-10
Epitácio Pessoa,11/03/1968,96.5,516923056.0,2574482.0,,1968-03-11
Epitácio Pessoa,12/03/1968,97.1,520233105.0,3310049.0,,1968-03-12
Epitácio Pessoa,13/03/1968,94.5,506073452.0,-14159653.0,,1968-03-13
Epitácio Pessoa,14/03/1968,98.8,529059902.0,22986450.0,,1968-03-14
Epitácio Pessoa,15/03/1968,99.8,534576650.0,5516748.0,,1968-03-15
Epitácio Pessoa,16/03/1968,100.0,535680000.0,1103350.0,,1968-03-16
Epitácio Pessoa,17/03/1968,100.0,535680000.0,0.0,,1968-03-17
Epitácio Pessoa,18/03/1968,100.0,535680000.0,0.0,,1968-03-18
Epitácio Pessoa,19/03/1968,100.0,535680000.0,0.0,,1968-03-19
Epitácio Pessoa,20/03/1968,100.0,535680000.0,0.0,,1968-03-20
Epitácio Pessoa,21/03/1968,100.0,535680000.0,0.0,,1968-03-21
Epitácio Pessoa,22/03/1968,100.0,535680000.0,0.0,,1968-03-22
Epitácio Pessoa,23/03/1968,100.0,535680000.0,0.0,,1968-03-23
Epitácio Pessoa,24/03/1968,100.0,535680000.0,0.0,,1968-03-24
Epitácio Pessoa,25/03/1968,100.0,535680000.0,0.0,,1968-03-25
Epitácio Pessoa,26/03/1968,100.0,535680000.0,0.0,,1968-03-26
Epitácio Pessoa,27/03/1968,100.0,535680000.0,0.0,,1968-03-27
Epitácio Pessoa,28/03/1968,100.0,535680000.0,0.0,,1968-03-28
Epitácio Pessoa,29/03/1968,100.0,535680000.0,0.0,,1968-03-29
Epitácio Pessoa,30/03/1968,100.0,535680000.0,0.0,,1968-03-30
Epitácio Pessoa,31/03/1968,100.0,535680000.0,0.0,,1968-03-31
Epitácio Pessoa,01/04/1968,100.0,535680000.0,0.0,,1968-04-01
Epitácio Pessoa,02/04/1968,100.0,535680000.0,0.0,,1968-04-02
Epitácio Pessoa,03/04/1968,100.0,535680000.0,0.0,,1968-04-03
Epitácio Pessoa,04/04/1968,100.0,535680000.0,0.0,,1968-04-04
Epitácio Pessoa,05/04/1968,99.9,535128325.0,-551675.0,,1968-04-05
Epitácio Pessoa,06/04/1968,99.8,534760542.0,-367783.0,,1968-04-06
Epitácio Pessoa,07/04/1968,99.8,534392759.0,-367783.0,,1968-04-07
Epitácio Pessoa,08/04/1968,99.7,534024976.0,-367783.0,,1968-04-08
Epitácio Pessoa,09/04/1968,99.7,533841084.0,-183892.0,,1968-04-09
Epitácio Pessoa,10/04/1968,99.6,533657192.0,-183892.0,,1968-04-10
Epitácio Pessoa,11/04/1968,99.6,533473301.0,-183891.0,,1968-04-11
Epitácio Pessoa,12/04/1968,99.6,533289409.0,-183892.0,,1968-04-12
Epitácio Pessoa,13/04/1968,99.5,533105518.0,-183891.0,,1968-04-13
Epitácio Pessoa,14/04/1968,99.8,534576650.0,1471132.0,,1968-04-14
Epitácio Pessoa,15/04/1968,100.0,535496108.0,919458.0,,1968-04-15
Epitácio Pessoa,16/04/1968,100.0,535680000.0,183892.0,,1968-04-16
Epitácio Pessoa,17/04/1968,100.0,535680000.0,0.0,,1968-04-17
Epitácio Pessoa,18/04/1968,99.9,535312217.0,-367783.0,,1968-04-18
Epitácio Pessoa,19/04/1968,99.9,534944434.0,-367783.0,,1968-04-19
Epitácio Pessoa,20/04/1968,99.9,534944434.0,0.0,,1968-04-20
Epitácio Pessoa,21/04/1968,100.0,535680000.0,735566.0,,1968-04-21
Epitácio Pessoa,22/04/1968,100.0,535680000.0,0.0,,1968-04-22
Epitácio Pessoa,23/04/1968,100.0,535680000.0,0.0,,1968-04-23
Epitácio Pessoa,24/04/1968,100.0,535680000.0,0.0,,1968-04-24
Epitácio Pessoa,25/04/1968,100.0,535680000.0,0.0,,1968-04-25
Epitácio Pessoa,26/04/1968,100.0,535680000.0,0.0,,1968-04-26
Epitácio Pessoa,27/04/1968,100.0,535680000.0,0.0,,1968-04-27
Epitácio Pessoa,28/04/1968,100.0,535680000.0,0.0,,1968-04-28
Epitácio Pessoa,29/04/1968,100.0,535680000.0,0.0,,1968-04-29
Epitácio Pessoa,30/04/1968,100.0,535680000.0,0.0,,1968-04-30
Epitácio Pessoa,01/05/1968,100.0,535680000.0,0.0,,1968-05-01
Epitácio Pessoa,02/05/1968,100.0,535680000.0,0.0,,1968-05-02
Epitácio Pessoa,03/05/1968,100.0,535680000.0,0.0,,1968-05-03
Epitácio Pessoa,04/05/1968,100.0,535680000.0,0.0,,1968-05-04
Epitácio Pessoa,05/05/1968,100.0,535680000.0,0.0,,1968-05-05
Epitácio Pessoa,06/05/1968,100.0,535680000.0,0.0,,1968-05-06
Epitácio Pessoa,07/05/1968,100.0,535680000.0,0.0,,1968-05-07
Epitácio Pessoa,08/05/1968,100.0,535680000.0,0.0,,1968-05-08
Epitácio Pessoa,09/05/1968,100.0,535680000.0,0.0,,1968-05-09
Epitácio Pessoa,10/05/1968,100.0,535680000.0,0.0,,1968-05-10
Epitácio Pessoa,11/05/1968,100.0,535680000.0,0.0,,1968-05-11
Epitácio Pessoa,12/05/1968,100.0,535680000.0,0.0,,1968-05-12
Epitácio Pessoa,13/05/1968,100.0,535680000.0,0.0,,1968-05-13
Epitácio Pessoa,14/05/1968,100.0,535680000.0,0.0,,1968-05-14
Epitácio Pessoa,15/05/1968,100.0,535680000.0,0.0,,1968-05-15
Epitácio Pessoa,16/05/1968,100.0,535680000.0,0.0,,1968-05-16
Epitácio Pessoa,17/05/1968,100.0,535680000.0,0.0,,1968-05-17
Epitácio Pessoa,18/05/1968,100.0,535680000.0,0.0,,1968-05-18
Epitácio Pessoa,19/05/1968,100.0,535680000.0,0.0,,1968-05-19
Epitácio Pessoa,20/05/1968,100.0,535680000.0,0.0,,1968-05-20
Epitácio Pessoa,21/05/1968,100.0,535680000.0,0.0,,1968-05-21
Epitácio Pessoa,22/05/1968,100.0,535680000.0,0.0,,1968-05-22
Epitácio Pessoa,23/05/1968,100.0,535680000.0,0.0,,1968-05-23
Epitácio Pessoa,24/05/1968,100.0,535680000.0,0.0,,1968-05-24
Epitácio Pessoa,25/05/1968,100.0,535680000.0,0.0,,1968-05-25
Epitácio Pessoa,26/05/1968,100.0,535680000.0,0.0,,1968-05-26
Epitácio Pessoa,27/05/1968,100.0,535680000.0,0.0,,1968-05-27
Epitácio Pessoa,28/05/1968,100.0,535680000.0,0.0,,1968-05-28
Epitácio Pessoa,29/05/1968,100.0,535680000.0,0.0,,1968-05-29
Epitácio Pessoa,30/05/1968,100.0,535680000.0,0.0,,1968-05-30
Epitácio Pessoa,31/05/1968,100.0,535680000.0,0.0,,1968-05-31
Epitácio Pessoa,01/06/1968,100.0,535680000.0,0.0,,1968-06-01
Epitácio Pessoa,02/06/1968,100.0,535680000.0,0.0,,1968-06-02
Epitácio Pessoa,03/06/1968,100.0,535680000.0,0.0,,1968-06-03
Epitácio Pessoa,04/06/1968,100.0,535680000.0,0.0,,1968-06-04
Epitácio Pessoa,05/06/1968,100.0,535680000.0,0.0,,1968-06-05
Epitácio Pessoa,06/06/1968,100.0,535496108.0,-183892.0,,1968-06-06
Epitácio Pessoa,07/06/1968,99.9,535128325.0,-367783.0,,1968-06-07
Epitácio Pessoa,08/06/1968,99.8,534760542.0,-367783.0,,1968-06-08
Epitácio Pessoa,09/06/1968,99.8,534392759.0,-367783.0,,1968-06-09
Epitácio Pessoa,10/06/1968,99.7,534024976.0,-367783.0,,1968-06-10
Epitácio Pessoa,11/06/1968,99.6,533657192.0,-367784.0,,1968-06-11
Epitácio Pessoa,12/06/1968,99.6,533473301.0,-183891.0,,1968-06-12
Epitácio Pessoa,13/06/1968,99.6,533289409.0,-183892.0,,1968-06-13
Epitácio Pessoa,14/06/1968,99.6,533289409.0,0.0,,1968-06-14
Epitácio Pessoa,15/06/1968,99.6,533289409.0,0.0,,1968-06-15
Epitácio Pessoa,16/06/1968,99.6,533289409.0,0.0,,1968-06-16
Epitácio Pessoa,17/06/1968,99.6,533289409.0,0.0,,1968-06-17
Epitácio Pessoa,18/06/1968,99.6,533289409.0,0.0,,1968-06-18
Epitácio Pessoa,19/06/1968,99.6,533289409.0,0.0,,1968-06-19
Epitácio Pessoa,20/06/1968,99.6,533289409.0,0.0,,1968-06-20
Epitácio Pessoa,21/06/1968,99.5,533105518.0,-183891.0,,1968-06-21
Epitácio Pessoa,22/06/1968,99.5,532921626.0,-183892.0,,1968-06-22
Epitácio Pessoa,23/06/1968,99.5,532737734.0,-183892.0,,1968-06-23
Epitácio Pessoa,24/06/1968,99.4,532553843.0,-183891.0,,1968-06-24
Epitácio Pessoa,25/06/1968,99.4,532369951.0,-183892.0,,1968-06-25
Epitácio Pessoa,26/06/1968,99.3,532186060.0,-183891.0,,1968-06-26
Epitácio Pessoa,27/06/1968,99.3,532002168.0,-183892.0,,1968-06-27
Epitácio Pessoa,28/06/1968,99.3,531818276.0,-183892.0,,1968-06-28
Epitácio Pessoa,29/06/1968,99.3,531818276.0,0.0,,1968-06-29
Epitácio Pessoa,30/06/1968,99.3,531818276.0,0.0,,1968-06-30
Epitácio Pessoa,01/07/1968,99.3,531818276.0,0.0,,1968-07-01
Epitácio Pessoa,02/07/1968,99.3,531818276.0,0.0,,1968-07-02
Epitácio Pessoa,03/07/1968,99.3,531818276.0,0.0,,1968-07-03
Epitácio Pessoa,04/07/1968,99.3,531818276.0,0.0,,1968-07-04
Epitácio Pessoa,05/07/1968,99.2,531634385.0,-183891.0,,1968-07-05
Epitácio Pessoa,06/07/1968,99.2,531450493.0,-183892.0,,1968-07-06
Epitácio Pessoa,07/07/1968,99.2,531266601.0,-183892.0,,1968-07-07
Epitácio Pessoa,08/07/1968,99.1,531082710.0,-183891.0,,1968-07-08
Epitácio Pessoa,09/07/1968,99.1,530898818.0,-183892.0,,1968-07-09
Epitácio Pessoa,10/07/1968,99.1,530714927.0,-183891.0,,1968-07-10
Epitácio Pessoa,11/07/1968,99.1,530714927.0,0.0,,1968-07-11
Epitácio Pessoa,12/07/1968,99.1,530714927.0,0.0,,1968-07-12
Epitácio Pessoa,13/07/1968,99.0,530531035.0,-183892.0,,1968-07-13
Epitácio Pessoa,14/07/1968,99.0,530347143.0,-183892.0,,1968-07-14
Epitácio Pessoa,15/07/1968,99.0,530163252.0,-183891.0,,1968-07-15
Epitácio Pessoa,16/07/1968,99.0,530163252.0,0.0,,1968-07-16
Epitácio Pessoa,17/07/1968,99.0,530163252.0,0.0,,1968-07-17
Epitácio Pessoa,18/07/1968,98.9,529979360.0,-183892.0,,1968-07-18
Epitácio Pessoa,19/07/1968,98.9,529795469.0,-183891.0,,1968-07-19
Epitácio Pessoa,20/07/1968,98.9,529611577.0,-183892.0,,1968-07-20
Epitácio Pessoa,21/07/1968,98.8,529427685.0,-183892.0,,1968-07-21
Epitácio Pessoa,22/07/1968,98.8,529427685.0,0.0,,1968-07-22
Epitácio Pessoa,23/07/1968,98.8,529243794.0,-183891.0,,1968-07-23
Epitácio Pessoa,24/07/1968,98.8,529243794.0,0.0,,1968-07-24
Epitácio Pessoa,25/07/1968,98.8,529243794.0,0.0,,1968-07-25
Epitácio Pessoa,26/07/1968,98.8,529059902.0,-183892.0,,1968-07-26
Epitácio Pessoa,27/07/1968,98.8,529059902.0,0.0,,1968-07-27
Epitácio Pessoa,28/07/1968,98.8,529059902.0,0.0,,1968-07-28
Epitácio Pessoa,29/07/1968,98.8,529059902.0,0.0,,1968-07-29
Epitácio Pessoa,30/07/1968,98.7,528876011.0,-183891.0,,1968-07-30
Epitácio Pessoa,31/07/1968,98.7,528692119.0,-183892.0,,1968-07-31
Epitácio Pessoa,01/08/1968,98.7,528692119.0,0.0,,1968-08-01
Epitácio Pessoa,02/08/1968,98.7,528508227.0,-183892.0,,1968-08-02
Epitácio Pessoa,03/08/1968,98.7,528508227.0,0.0,,1968-08-03
Epitácio Pessoa,04/08/1968,98.6,528324336.0,-183891.0,,1968-08-04
Epitácio Pessoa,05/08/1968,98.6,528140444.0,-183892.0,,1968-08-05
Epitácio Pessoa,06/08/1968,98.6,527956553.0,-183891.0,,1968-08-06
Epitácio Pessoa,07/08/1968,98.5,527772661.0,-183892.0,,1968-08-07
Epitácio Pessoa,08/08/1968,98.5,527588769.0,-183892.0,,1968-08-08
Epitácio Pessoa,09/08/1968,98.5,527404878.0,-183891.0,,1968-08-09
Epitácio Pessoa,10/08/1968,98.4,527220986.0,-183892.0,,1968-08-10
Epitácio Pessoa,11/08/1968,98.4,527037095.0,-183891.0,,1968-08-11
Epitácio Pessoa,12/08/1968,98.4,526853203.0,-183892.0,,1968-08-12
Epitácio Pessoa,13/08/1968,98.3,526669311.0,-183892.0,,1968-08-13
Epitácio Pessoa,14/08/1968,98.3,526485420.0,-183891.0,,1968-08-14
Epitácio Pessoa,15/08/1968,98.2,526301528.0,-183892.0,,1968-08-15
Epitácio Pessoa,16/08/1968,98.2,526117637.0,-183891.0,,1968-08-16
Epitácio Pessoa,17/08/1968,98.2,526117637.0,0.0,,1968-08-17
Epitácio Pessoa,18/08/1968,98.2,525933745.0,-183892.0,,1968-08-18
Epitácio Pessoa,19/08/1968,98.2,525933745.0,0.0,,1968-08-19
Epitácio Pessoa,20/08/1968,98.1,525749853.0,-183892.0,,1968-08-20
Epitácio Pessoa,21/08/1968,98.1,525749853.0,0.0,,1968-08-21
Epitácio Pessoa,22/08/1968,98.1,525565962.0,-183891.0,,1968-08-22
Epitácio Pessoa,23/08/1968,98.1,525565962.0,0.0,,1968-08-23
Epitácio Pessoa,24/08/1968,98.1,525382070.0,-183892.0,,1968-08-24
Epitácio Pessoa,25/08/1968,98.0,525198179.0,-183891.0,,1968-08-25
Epitácio Pessoa,26/08/1968,98.0,525198179.0,0.0,,1968-08-26
Epitácio Pessoa,27/08/1968,98.0,525014287.0,-183892.0,,1968-08-27
Epitácio Pessoa,28/08/1968,98.0,525014287.0,0.0,,1968-08-28
Epitácio Pessoa,29/08/1968,98.0,524830395.0,-183892.0,,1968-08-29
Epitácio Pessoa,30/08/1968,98.0,524830395.0,0.0,,1968-08-30
Epitácio Pessoa,31/08/1968,97.9,524646504.0,-183891.0,,1968-08-31
Epitácio Pessoa,01/09/1968,97.9,524462612.0,-183892.0,,1968-09-01
Epitácio Pessoa,02/09/1968,97.9,524462612.0,0.0,,1968-09-02
Epitácio Pessoa,03/09/1968,97.9,524278720.0,-183892.0,,1968-09-03
Epitácio Pessoa,04/09/1968,97.8,524094829.0,-183891.0,,1968-09-04
Epitácio Pessoa,05/09/1968,97.8,523910937.0,-183892.0,,1968-09-05
Epitácio Pessoa,06/09/1968,97.8,523727046.0,-183891.0,,1968-09-06
Epitácio Pessoa,07/09/1968,97.7,523543154.0,-183892.0,,1968-09-07
Epitácio Pessoa,08/09/1968,97.7,523359262.0,-183892.0,,1968-09-08
Epitácio Pessoa,09/09/1968,97.7,523175371.0,-183891.0,,1968-09-09
Epitácio Pessoa,10/09/1968,97.6,522991479.0,-183892.0,,1968-09-10
Epitácio Pessoa,11/09/1968,97.6,522807588.0,-183891.0,,1968-09-11
Epitácio Pessoa,12/09/1968,97.6,522623696.0,-183892.0,,1968-09-12
Epitácio Pessoa,13/09/1968,97.5,522439804.0,-183892.0,,1968-09-13
Epitácio Pessoa,14/09/1968,97.5,522255913.0,-183891.0,,1968-09-14
Epitácio Pessoa,15/09/1968,97.5,522072021.0,-183892.0,,1968-09-15
Epitácio Pessoa,16/09/1968,97.4,521888130.0,-183891.0,,1968-09-16
Epitácio Pessoa,17/09/1968,97.4,521704238.0,-183892.0,,1968-09-17
Epitácio Pessoa,18/09/1968,97.4,521520346.0,-183892.0,,1968-09-18
Epitácio Pessoa,19/09/1968,97.3,521336455.0,-183891.0,,1968-09-19
Epitácio Pessoa,20/09/1968,97.3,521152563.0,-183892.0,,1968-09-20
Epitácio Pessoa,21/09/1968,97.3,520968672.0,-183891.0,,1968-09-21
Epitácio Pessoa,22/09/1968,97.2,520784780.0,-183892.0,,1968-09-22
Epitácio Pessoa,23/09/1968,97.2,520600888.0,-183892.0,,1968-09-23
Epitácio Pessoa,24/09/1968,97.2,520416997.0,-183891.0,,1968-09-24
Epitácio Pessoa,25/09/1968,97.1,520233105.0,-183892.0,,1968-09-25
Epitácio Pessoa,26/09/1968,97.1,520049214.0,-183891.0,,1968-09-26
Epitácio Pessoa,27/09/1968,97.0,519865322.0,-183892.0,,1968-09-27
Epitácio Pessoa,28/09/1968,97.0,519865322.0,0.0,,1968-09-28
Epitácio Pessoa,29/09/1968,97.0,519681430.0,-183892.0,,1968-09-29
Epitácio Pessoa,30/09/1968,97.0,519681430.0,0.0,,1968-09-30
Epitácio Pessoa,01/10/1968,97.0,519497539.0,-183891.0,,1968-10-01
Epitácio Pessoa,02/10/1968,97.0,519497539.0,0.0,,1968-10-02
Epitácio Pessoa,03/10/1968,96.9,519313647.0,-183892.0,,1968-10-03
Epitácio Pessoa,04/10/1968,96.9,519129756.0,-183891.0,,1968-10-04
Epitácio Pessoa,05/10/1968,96.9,518945864.0,-183892.0,,1968-10-05
Epitácio Pessoa,06/10/1968,96.8,518761972.0,-183892.0,,1968-10-06
Epitácio Pessoa,07/10/1968,96.8,518578081.0,-183891.0,,1968-10-07
Epitácio Pessoa,08/10/1968,96.8,518394189.0,-183892.0,,1968-10-08
Epitácio Pessoa,09/10/1968,96.7,518210298.0,-183891.0,,1968-10-09
Epitácio Pessoa,10/10/1968,96.7,518026406.0,-183892.0,,1968-10-10
Epitácio Pessoa,11/10/1968,96.7,517842514.0,-183892.0,,1968-10-11
Epitácio Pessoa,12/10/1968,96.6,517658623.0,-183891.0,,1968-10-12
Epitácio Pessoa,13/10/1968,96.6,517474731.0,-183892.0,,1968-10-13
Epitácio Pessoa,14/10/1968,96.6,517290840.0,-183891.0,,1968-10-14
Epitácio Pessoa,15/10/1968,96.5,517106948.0,-183892.0,,1968-10-15
Epitácio Pessoa,16/10/1968,96.5,516923056.0,-183892.0,,1968-10-16
Epitácio Pessoa,17/10/1968,96.5,516739165.0,-183891.0,,1968-10-17
Epitácio Pessoa,18/10/1968,96.4,516555273.0,-183892.0,,1968-10-18
Epitácio Pessoa,19/10/1968,96.4,516371381.0,-183892.0,,1968-10-19
Epitácio Pessoa,20/10/1968,96.4,516187490.0,-183891.0,,1968-10-20
Epitácio Pessoa,21/10/1968,96.3,516003598.0,-183892.0,,1968-10-21
Epitácio Pessoa,22/10/1968,96.3,515819707.0,-183891.0,,1968-10-22
Epitácio Pessoa,23/10/1968,96.3,515635815.0,-183892.0,,1968-10-23
Epitácio Pessoa,24/10/1968,96.2,515451923.0,-183892.0,,1968-10-24
Epitácio Pessoa,25/10/1968,96.2,515268032.0,-183891.0,,1968-10-25
Epitácio Pessoa,26/10/1968,96.2,515084140.0,-183892.0,,1968-10-26
Epitácio Pessoa,27/10/1968,96.1,514900249.0,-183891.0,,1968-10-27
Epitácio Pessoa,28/10/1968,96.1,514900249.0,0.0,,1968-10-28
Epitácio Pessoa,29/10/1968,96.1,514716357.0,-183892.0,,1968-10-29
Epitácio Pessoa,30/10/1968,96.1,514532465.0,-183892.0,,1968-10-30
Epitácio Pessoa,31/10/1968,96.0,514348574.0,-183891.0,,1968-10-31
Epitácio Pessoa,01/11/1968,96.0,514164682.0,-183892.0,,1968-11-01
Epitácio Pessoa,02/11/1968,96.0,514164682.0,0.0,,1968-11-02
Epitácio Pessoa,03/11/1968,95.9,513980791.0,-183891.0,,1968-11-03
Epitácio Pessoa,04/11/1968,95.9,513796899.0,-183892.0,,1968-11-04
Epitácio Pessoa,05/11/1968,95.9,513613007.0,-183892.0,,1968-11-05
Epitácio Pessoa,06/11/1968,95.8,513429116.0,-183891.0,,1968-11-06
Epitácio Pessoa,07/11/1968,95.8,513245224.0,-183892.0,,1968-11-07
Epitácio Pessoa,08/11/1968,95.8,513061333.0,-183891.0,,1968-11-08
Epitácio Pessoa,09/11/1968,95.7,512877441.0,-183892.0,,1968-11-09
Epitácio Pessoa,10/11/1968,95.7,512693549.0,-183892.0,,1968-11-10
Epitácio Pessoa,11/11/1968,95.7,512509658.0,-183891.0,,1968-11-11
Epitácio Pessoa,12/11/1968,95.6,512325766.0,-183892.0,,1968-11-12
Epitácio Pessoa,13/11/1968,95.6,512141875.0,-183891.0,,1968-11-13
Epitácio Pessoa,14/11/1968,95.6,511957983.0,-183892.0,,1968-11-14
Epitácio Pessoa,15/11/1968,95.5,511774091.0,-183892.0,,1968-11-15
Epitácio Pessoa,16/11/1968,95.5,511590200.0,-183891.0,,1968-11-16
Epitácio Pessoa,17/11/1968,95.5,511406308.0,-183892.0,,1968-11-17
Epitácio Pessoa,18/11/1968,95.4,511222417.0,-183891.0,,1968-11-18
Epitácio Pessoa,19/11/1968,95.4,511038525.0,-183892.0,,1968-11-19
Epitácio Pessoa,20/11/1968,95.4,510854633.0,-183892.0,,1968-11-20
Epitácio Pessoa,21/11/1968,95.3,510670742.0,-183891.0,,1968-11-21
Epitácio Pessoa,22/11/1968,95.3,510486850.0,-183892.0,,1968-11-22
Epitácio Pessoa,23/11/1968,95.3,510302959.0,-183891.0,,1968-11-23
Epitácio Pessoa,24/11/1968,95.2,510119067.0,-183892.0,,1968-11-24
Epitácio Pessoa,25/11/1968,95.2,509935175.0,-183892.0,,1968-11-25
Epitácio Pessoa,26/11/1968,95.2,509935175.0,0.0,,1968-11-26
Epitácio Pessoa,27/11/1968,95.2,509751284.0,-183891.0,,1968-11-27
Epitácio Pessoa,28/11/1968,95.1,509567392.0,-183892.0,,1968-11-28
Epitácio Pessoa,29/11/1968,95.1,509383500.0,-183892.0,,1968-11-29
Epitácio Pessoa,30/11/1968,95.1,509199609.0,-183891.0,,1968-11-30
Epitácio Pessoa,01/12/1968,95.0,509015717.0,-183892.0,,1968-12-01
Epitácio Pessoa,02/12/1968,95.0,509015717.0,0.0,,1968-12-02
Epitácio Pessoa,03/12/1968,95.0,508831826.0,-183891.0,,1968-12-03
Epitácio Pessoa,04/12/1968,95.0,508647934.0,-183892.0,,1968-12-04
Epitácio Pessoa,05/12/1968,95.0,508647934.0,0.0,,1968-12-05
Epitácio Pessoa,06/12/1968,94.9,508464042.0,-183892.0,,1968-12-06
Epitácio Pessoa,07/12/1968,94.9,508280151.0,-183891.0,,1968-12-07
Epitácio Pessoa,08/12/1968,94.9,508096259.0,-183892.0,,1968-12-08
Epitácio Pessoa,09/12/1968,94.8,507912368.0,-183891.0,,1968-12-09
Epitácio Pessoa,10/12/1968,94.8,507728476.0,-183892.0,,1968-12-10
Epitácio Pessoa,11/12/1968,94.7,507544584.0,-183892.0,,1968-12-11
Epitácio Pessoa,12/12/1968,94.7,507360693.0,-183891.0,,1968-12-12
Epitácio Pessoa,13/12/1968,94.7,507176801.0,-183892.0,,1968-12-13
Epitácio Pessoa,14/12/1968,94.6,506992910.0,-183891.0,,1968-12-14
Epitácio Pessoa,15/12/1968,94.6,506809018.0,-183892.0,,1968-12-15
Epitácio Pessoa,16/12/1968,94.6,506625126.0,-183892.0,,1968-12-16
Epitácio Pessoa,17/12/1968,94.5,506441235.0,-183891.0,,1968-12-17
Epitácio Pessoa,18/12/1968,94.5,506257343.0,-183892.0,,1968-12-18
Epitácio Pessoa,19/12/1968,94.5,506073452.0,-183891.0,,1968-12-19
Epitácio Pessoa,20/12/1968,94.4,505889560.0,-183892.0,,1968-12-20
Epitácio Pessoa,21/12/1968,94.4,505705668.0,-183892.0,,1968-12-21
Epitácio Pessoa,22/12/1968,94.4,505521777.0,-183891.0,,1968-12-22
Epitácio Pessoa,23/12/1968,94.3,505337885.0,-183892.0,,1968-12-23
Epitácio Pessoa,24/12/1968,94.3,505153994.0,-183891.0,,1968-12-24
Epitácio Pessoa,25/12/1968,94.3,504970102.0,-183892.0,,1968-12-25
Epitácio Pessoa,26/12/1968,94.2,504786210.0,-183892.0,,1968-12-26
Epitácio Pessoa,27/12/1968,94.2,504786210.0,0.0,,1968-12-27
Epitácio Pessoa,28/12/1968,94.2,504602319.0,-183891.0,,1968-12-28
Epitácio Pessoa,29/12/1968,94.2,504602319.0,0.0,,1968-12-29
Epitácio Pessoa,30/12/1968,94.2,504418427.0,-183892.0,,1968-12-30
Epitácio Pessoa,01/01/1972,92.0,492596370.0,0.0,,1972-01-01
Epitácio Pessoa,02/01/1972,91.9,492202288.0,-394082.0,,1972-01-02
Epitácio Pessoa,03/01/1972,91.8,491808207.0,-394081.0,,1972-01-03
Epitácio Pessoa,04/01/1972,91.7,491414125.0,-394082.0,,1972-01-04
Epitácio Pessoa,05/01/1972,91.7,491020043.0,-394082.0,,1972-01-05
Epitácio Pessoa,06/01/1972,91.6,490625961.0,-394082.0,,1972-01-06
Epitácio Pessoa,07/01/1972,91.5,490231880.0,-394081.0,,1972-01-07
Epitácio Pessoa,08/01/1972,91.4,489837798.0,-394082.0,,1972-01-08
Epitácio Pessoa,09/01/1972,91.4,489443716.0,-394082.0,,1972-01-09
Epitácio Pessoa,10/01/1972,91.3,489049634.0,-394082.0,,1972-01-10
Epitácio Pessoa,11/01/1972,91.2,488655552.0,-394082.0,,1972-01-11
Epitácio Pessoa,12/01/1972,91.1,488261471.0,-394081.0,,1972-01-12
Epitácio Pessoa,13/01/1972,91.1,487867389.0,-394082.0,,1972-01-13
Epitácio Pessoa,14/01/1972,91.0,487473307.0,-394082.0,,1972-01-14
Epitácio Pessoa,15/01/1972,90.9,487079225.0,-394082.0,,1972-01-15
Epitácio Pessoa,16/01/1972,90.9,486685143.0,-394082.0,,1972-01-16
Epitácio Pessoa,17/01/1972,90.8,486291062.0,-394081.0,,1972-01-17
Epitácio Pessoa,18/01/1972,90.7,485896980.0,-394082.0,,1972-01-18
Epitácio Pessoa,19/01/1972,90.6,485502898.0,-394082.0,,1972-01-19
Epitácio Pessoa,20/01/1972,90.6,485502898.0,0.0,,1972-01-20
Epitácio Pessoa,21/01/1972,90.6,485108816.0,-394082.0,,1972-01-21
Epitácio Pessoa,22/01/1972,90.6,485108816.0,0.0,,1972-01-22
Epitácio Pessoa,23/01/1972,90.5,484714734.0,-394082.0,,1972-01-23
Epitácio Pessoa,24/01/1972,90.4,484320653.0,-394081.0,,1972-01-24
Epitácio Pessoa,25/01/1972,90.3,483926571.0,-394082.0,,1972-01-25
Epitácio Pessoa,26/01/1972,90.3,483532489.0,-394082.0,,1972-01-26
Epitácio Pessoa,27/01/1972,90.2,483138407.0,-394082.0,,1972-01-27
Epitácio Pessoa,28/01/1972,90.1,482744325.0,-394082.0,,1972-01-28
Epitácio Pessoa,29/01/1972,90.0,482350244.0,-394081.0,,1972-01-29
Epitácio Pessoa,30/01/1972,90.0,481956162.0,-394082.0,,1972-01-30
Epitácio Pessoa,31/01/1972,89.9,481562080.0,-394082.0,,1972-01-31
Epitácio Pessoa,01/02/1972,89.8,481167998.0,-394082.0,,1972-02-01
Epitácio Pessoa,02/02/1972,89.8,480773916.0,-394082.0,,1972-02-02
Epitácio Pessoa,03/02/1972,89.7,480379835.0,-394081.0,,1972-02-03
Epitácio Pessoa,04/02/1972,89.6,479985753.0,-394082.0,,1972-02-04
Epitácio Pessoa,05/02/1972,89.5,479591671.0,-394082.0,,1972-02-05
Epitácio Pessoa,06/02/1972,89.5,479197589.0,-394082.0,,1972-02-06
Epitácio Pessoa,07/02/1972,89.4,478803507.0,-394082.0,,1972-02-07
Epitácio Pessoa,08/02/1972,89.3,478409426.0,-394081.0,,1972-02-08
Epitácio Pessoa,09/02/1972,89.2,478015344.0,-394082.0,,1972-02-09
Epitácio Pessoa,10/02/1972,89.2,477621262.0,-394082.0,,1972-02-10
Epitácio Pessoa,11/02/1972,89.1,477227180.0,-394082.0,,1972-02-11
Epitácio Pessoa,12/02/1972,89.1,477227180.0,0.0,,1972-02-12
Epitácio Pessoa,13/02/1972,89.1,477227180.0,0.0,,1972-02-13
Epitácio Pessoa,14/02/1972,89.2,477621262.0,394082.0,,1972-02-14
Epitácio Pessoa,15/02/1972,89.2,477621262.0,0.0,,1972-02-15
Epitácio Pessoa,16/02/1972,89.2,477621262.0,0.0,,1972-02-16
Epitácio Pessoa,17/02/1972,89.2,477621262.0,0.0,,1972-02-17
Epitácio Pessoa,18/02/1972,89.1,477227180.0,-394082.0,,1972-02-18
Epitácio Pessoa,19/02/1972,89.1,477227180.0,0.0,,1972-02-19
Epitácio Pessoa,20/02/1972,89.0,476833098.0,-394082.0,,1972-02-20
Epitácio Pessoa,21/02/1972,89.0,476833098.0,0.0,,1972-02-21
Epitácio Pessoa,22/02/1972,89.0,476833098.0,0.0,,1972-02-22
Epitácio Pessoa,23/02/1972,88.9,476439017.0,-394081.0,,1972-02-23
Epitácio Pessoa,24/02/1972,88.9,476044935.0,-394082.0,,1972-02-24
Epitácio Pessoa,25/02/1972,88.8,475650853.0,-394082.0,,1972-02-25
Epitácio Pessoa,26/02/1972,88.7,475256771.0,-394082.0,,1972-02-26
Epitácio Pessoa,27/02/1972,88.6,474862690.0,-394081.0,,1972-02-27
Epitácio Pessoa,28/02/1972,90.2,483138407.0,8275717.0,,1972-02-28
Epitácio Pessoa,29/02/1972,91.7,491020043.0,7881636.0,,1972-02-29
Epitácio Pessoa,01/03/1972,93.3,499637245.0,8617202.0,,1972-03-01
Epitácio Pessoa,02/03/1972,93.7,502027836.0,2390591.0,,1972-03-02
Epitácio Pessoa,03/03/1972,93.9,502763403.0,735567.0,,1972-03-03
Epitácio Pessoa,04/03/1972,93.9,502763403.0,0.0,,1972-03-04
Epitácio Pessoa,05/03/1972,93.9,502763403.0,0.0,,1972-03-05
Epitácio Pessoa,06/03/1972,93.9,502763403.0,0.0,,1972-03-06
Epitácio Pessoa,07/03/1972,93.9,502763403.0,0.0,,1972-03-07
Epitácio Pessoa,08/03/1972,93.9,502763403.0,0.0,,1972-03-08
Epitácio Pessoa,09/03/1972,93.8,502579511.0,-183892.0,,1972-03-09
Epitácio Pessoa,10/03/1972,93.8,502395619.0,-183892.0,,1972-03-10
Epitácio Pessoa,11/03/1972,93.8,502395619.0,0.0,,1972-03-11
Epitácio Pessoa,12/03/1972,93.8,502211728.0,-183891.0,,1972-03-12
Epitácio Pessoa,13/03/1972,93.7,502027836.0,-183892.0,,1972-03-13
Epitácio Pessoa,14/03/1972,93.7,501843945.0,-183891.0,,1972-03-14
Epitácio Pessoa,15/03/1972,93.6,501660053.0,-183892.0,,1972-03-15
Epitácio Pessoa,16/03/1972,93.6,501476161.0,-183892.0,,1972-03-16
Epitácio Pessoa,17/03/1972,93.6,501476161.0,0.0,,1972-03-17
Epitácio Pessoa,18/03/1972,93.6,501476161.0,0.0,,1972-03-18
Epitácio Pessoa,19/03/1972,93.7,501843945.0,367784.0,,1972-03-19
Epitácio Pessoa,20/03/1972,93.8,502579511.0,735566.0,,1972-03-20
Epitácio Pessoa,21/03/1972,94.0,503682861.0,1103350.0,,1972-03-21
Epitácio Pessoa,22/03/1972,94.2,504418427.0,735566.0,,1972-03-22
Epitácio Pessoa,23/03/1972,94.2,504418427.0,0.0,,1972-03-23
Epitácio Pessoa,24/03/1972,94.2,504418427.0,0.0,,1972-03-24
Epitácio Pessoa,25/03/1972,94.2,504418427.0,0.0,,1972-03-25
Epitácio Pessoa,26/03/1972,94.1,504234536.0,-183891.0,,1972-03-26
Epitácio Pessoa,27/03/1972,94.1,504050644.0,-183892.0,,1972-03-27
Epitácio Pessoa,28/03/1972,94.1,504050644.0,0.0,,1972-03-28
Epitácio Pessoa,29/03/1972,94.1,504050644.0,0.0,,1972-03-29
Epitácio Pessoa,30/03/1972,94.1,504050644.0,0.0,,1972-03-30
Epitácio Pessoa,31/03/1972,94.1,504050644.0,0.0,,1972-03-31
Epitácio Pessoa,01/04/1972,94.2,504418427.0,367783.0,,1972-04-01
Epitácio Pessoa,02/04/1972,94.3,504970102.0,551675.0,,1972-04-02
Epitácio Pessoa,03/04/1972,94.3,504970102.0,0.0,,1972-04-03
Epitácio Pessoa,04/04/1972,94.2,504786210.0,-183892.0,,1972-04-04
Epitácio Pessoa,05/04/1972,94.2,504786210.0,0.0,,1972-04-05
Epitácio Pessoa,06/04/1972,94.2,504602319.0,-183891.0,,1972-04-06
Epitácio Pessoa,07/04/1972,94.2,504602319.0,0.0,,1972-04-07
Epitácio Pessoa,08/04/1972,94.2,504418427.0,-183892.0,,1972-04-08
Epitácio Pessoa,09/04/1972,94.1,504234536.0,-183891.0,,1972-04-09
Epitácio Pessoa,10/04/1972,94.1,504050644.0,-183892.0,,1972-04-10
Epitácio Pessoa,11/04/1972,94.1,503866752.0,-183892.0,,1972-04-11
Epitácio Pessoa,12/04/1972,94.1,503866752.0,0.0,,1972-04-12
Epitácio Pessoa,13/04/1972,92.0,492596370.0,-11270382.0,,1972-04-13
Epitácio Pessoa,14/04/1972,94.0,503498969.0,10902599.0,,1972-04-14
Epitácio Pessoa,15/04/1972,94.0,503498969.0,0.0,,1972-04-15
Epitácio Pessoa,16/04/1972,94.0,503315078.0,-183891.0,,1972-04-16
Epitácio Pessoa,17/04/1972,94.0,503315078.0,0.0,,1972-04-17
Epitácio Pessoa,18/04/1972,94.0,503498969.0,183891.0,,1972-04-18
Epitácio Pessoa,19/04/1972,94.1,503866752.0,367783.0,,1972-04-19
Epitácio Pessoa,20/04/1972,94.2,504602319.0,735567.0,,1972-04-20
Epitácio Pessoa,21/04/1972,94.6,506625126.0,2022807.0,,1972-04-21
Epitácio Pessoa,22/04/1972,94.9,508096259.0,1471133.0,,1972-04-22
Epitácio Pessoa,23/04/1972,95.1,509567392.0,1471133.0,,1972-04-23
Epitácio Pessoa,24/04/1972,95.4,510854633.0,1287241.0,,1972-04-24
Epitácio Pessoa,25/04/1972,95.5,511406308.0,551675.0,,1972-04-25
Epitácio Pessoa,26/04/1972,95.5,511590200.0,183892.0,,1972-04-26
Epitácio Pessoa,27/04/1972,95.6,512141875.0,551675.0,,1972-04-27
Epitácio Pessoa,28/04/1972,95.8,513245224.0,1103349.0,,1972-04-28
Epitácio Pessoa,29/04/1972,95.8,513245224.0,0.0,,1972-04-29
Epitácio Pessoa,30/04/1972,95.8,513245224.0,0.0,,1972-04-30
Epitácio Pessoa,01/05/1972,96.1,514716357.0,1471133.0,,1972-05-01
Epitácio Pessoa,02/05/1972,96.5,516923056.0,2206699.0,,1972-05-02
Epitácio Pessoa,03/05/1972,96.6,517290840.0,367784.0,,1972-05-03
Epitácio Pessoa,04/05/1972,96.6,517658623.0,367783.0,,1972-05-04
Epitácio Pessoa,05/05/1972,96.6,517658623.0,0.0,,1972-05-05
Epitácio Pessoa,06/05/1972,96.6,517658623.0,0.0,,1972-05-06
Epitácio Pessoa,07/05/1972,96.7,518026406.0,367783.0,,1972-05-07
Epitácio Pessoa,08/05/1972,96.7,518026406.0,0.0,,1972-05-08
Epitácio Pessoa,09/05/1972,96.7,518026406.0,0.0,,1972-05-09
Epitácio Pessoa,10/05/1972,96.7,518026406.0,0.0,,1972-05-10
Epitácio Pessoa,11/05/1972,96.7,518210298.0,183892.0,,1972-05-11
Epitácio Pessoa,12/05/1972,96.7,518210298.0,0.0,,1972-05-12
Epitácio Pessoa,13/05/1972,96.7,518210298.0,0.0,,1972-05-13
Epitácio Pessoa,14/05/1972,96.7,518210298.0,0.0,,1972-05-14
Epitácio Pessoa,15/05/1972,96.7,518026406.0,-183892.0,,1972-05-15
Epitácio Pessoa,16/05/1972,96.7,518026406.0,0.0,,1972-05-16
Epitácio Pessoa,17/05/1972,96.7,518026406.0,0.0,,1972-05-17
Epitácio Pessoa,18/05/1972,96.7,517842514.0,-183892.0,,1972-05-18
Epitácio Pessoa,19/05/1972,96.7,517842514.0,0.0,,1972-05-19
Epitácio Pessoa,20/05/1972,96.7,517842514.0,0.0,,1972-05-20
Epitácio Pessoa,21/05/1972,96.6,517658623.0,-183891.0,,1972-05-21
Epitácio Pessoa,22/05/1972,96.6,517658623.0,0.0,,1972-05-22
Epitácio Pessoa,23/05/1972,96.6,517658623.0,0.0,,1972-05-23
Epitácio Pessoa,24/05/1972,96.6,517658623.0,0.0,,1972-05-24
Epitácio Pessoa,25/05/1972,96.6,517658623.0,0.0,,1972-05-25
Epitácio Pessoa,26/05/1972,96.6,517474731.0,-183892.0,,1972-05-26
Epitácio Pessoa,27/05/1972,96.6,517474731.0,0.0,,1972-05-27
Epitácio Pessoa,28/05/1972,96.6,517290840.0,-183891.0,,1972-05-28
Epitácio Pessoa,29/05/1972,96.6,517290840.0,0.0,,1972-05-29
Epitácio Pessoa,30/05/1972,96.5,517106948.0,-183892.0,,1972-05-30
Epitácio Pessoa,31/05/1972,96.5,516923056.0,-183892.0,,1972-05-31
Epitácio Pessoa,01/06/1972,96.5,516923056.0,0.0,,1972-06-01
Epitácio Pessoa,02/06/1972,96.5,517106948.0,183892.0,,1972-06-02
Epitácio Pessoa,03/06/1972,96.5,517106948.0,0.0,,1972-06-03
Epitácio Pessoa,04/06/1972,96.5,516923056.0,-183892.0,,1972-06-04
Epitácio Pessoa,05/06/1972,96.5,516923056.0,0.0,,1972-06-05
Epitácio Pessoa,06/06/1972,96.5,516739165.0,-183891.0,,1972-06-06
Epitácio Pessoa,07/06/1972,96.4,516555273.0,-183892.0,,1972-06-07
Epitácio Pessoa,08/06/1972,96.4,516555273.0,0.0,,1972-06-08
Epitácio Pessoa,09/06/1972,96.4,516371381.0,-183892.0,,1972-06-09
Epitácio Pessoa,10/06/1972,96.4,516371381.0,0.0,,1972-06-10
Epitácio Pessoa,11/06/1972,96.4,516187490.0,-183891.0,,1972-06-11
Epitácio Pessoa,12/06/1972,96.4,516187490.0,0.0,,1972-06-12
Epitácio Pessoa,13/06/1972,96.4,516371381.0,183891.0,,1972-06-13
Epitácio Pessoa,14/06/1972,96.4,516371381.0,0.0,,1972-06-14
Epitácio Pessoa,15/06/1972,96.4,516187490.0,-183891.0,,1972-06-15
Epitácio Pessoa,16/06/1972,96.4,516187490.0,0.0,,1972-06-16
Epitácio Pessoa,17/06/1972,96.3,516003598.0,-183892.0,,1972-06-17
Epitácio Pessoa,18/06/1972,96.3,515819707.0,-183891.0,,1972-06-18
Epitácio Pessoa,19/06/1972,96.3,515635815.0,-183892.0,,1972-06-19
Epitácio Pessoa,20/06/1972,96.2,515451923.0,-183892.0,,1972-06-20
Epitácio Pessoa,21/06/1972,96.2,515451923.0,0.0,,1972-06-21
Epitácio Pessoa,22/06/1972,96.2,515268032.0,-183891.0,,1972-06-22
Epitácio Pessoa,23/06/1972,96.2,515084140.0,-183892.0,,1972-06-23
Epitácio Pessoa,24/06/1972,96.2,515084140.0,0.0,,1972-06-24
Epitácio Pessoa,25/06/1972,96.1,514900249.0,-183891.0,,1972-06-25
Epitácio Pessoa,26/06/1972,97.2,520416997.0,5516748.0,,1972-06-26
Epitácio Pessoa,27/06/1972,96.1,514716357.0,-5700640.0,,1972-06-27
Epitácio Pessoa,28/06/1972,96.1,514532465.0,-183892.0,,1972-06-28
Epitácio Pessoa,29/06/1972,96.0,514348574.0,-183891.0,,1972-06-29
Epitácio Pessoa,30/06/1972,96.0,514164682.0,-183892.0,,1972-06-30
Epitácio Pessoa,01/07/1972,96.0,514164682.0,0.0,,1972-07-01
Epitácio Pessoa,02/07/1972,95.9,513980791.0,-183891.0,,1972-07-02
Epitácio Pessoa,03/07/1972,95.9,513980791.0,0.0,,1972-07-03
Epitácio Pessoa,04/07/1972,95.9,513796899.0,-183892.0,,1972-07-04
Epitácio Pessoa,05/07/1972,95.9,513796899.0,0.0,,1972-07-05
Epitácio Pessoa,06/07/1972,95.9,513613007.0,-183892.0,,1972-07-06
Epitácio Pessoa,07/07/1972,95.9,513613007.0,0.0,,1972-07-07
Epitácio Pessoa,08/07/1972,95.9,513613007.0,0.0,,1972-07-08
Epitácio Pessoa,09/07/1972,95.9,513613007.0,0.0,,1972-07-09
Epitácio Pessoa,10/07/1972,95.9,513613007.0,0.0,,1972-07-10
Epitácio Pessoa,11/07/1972,95.8,513429116.0,-183891.0,,1972-07-11
Epitácio Pessoa,12/07/1972,95.8,513429116.0,0.0,,1972-07-12
Epitácio Pessoa,13/07/1972,95.8,513245224.0,-183892.0,,1972-07-13
Epitácio Pessoa,14/07/1972,95.8,513245224.0,0.0,,1972-07-14
Epitácio Pessoa,15/07/1972,95.8,513061333.0,-183891.0,,1972-07-15
Epitácio Pessoa,16/07/1972,95.7,512877441.0,-183892.0,,1972-07-16
Epitácio Pessoa,17/07/1972,95.7,512693549.0,-183892.0,,1972-07-17
Epitácio Pessoa,18/07/1972,95.7,512693549.0,0.0,,1972-07-18
Epitácio Pessoa,19/07/1972,95.7,512509658.0,-183891.0,,1972-07-19
Epitácio Pessoa,20/07/1972,95.7,512509658.0,0.0,,1972-07-20
Epitácio Pessoa,21/07/1972,95.7,512509658.0,0.0,,1972-07-21
Epitácio Pessoa,22/07/1972,95.6,512325766.0,-183892.0,,1972-07-22
Epitácio Pessoa,23/07/1972,95.6,512141875.0,-183891.0,,1972-07-23
Epitácio Pessoa,24/07/1972,95.6,512141875.0,0.0,,1972-07-24
Epitácio Pessoa,25/07/1972,95.6,511957983.0,-183892.0,,1972-07-25
Epitácio Pessoa,26/07/1972,95.5,511774091.0,-183892.0,,1972-07-26
Epitácio Pessoa,27/07/1972,95.5,511590200.0,-183891.0,,1972-07-27
Epitácio Pessoa,28/07/1972,95.5,511406308.0,-183892.0,,1972-07-28
Epitácio Pessoa,29/07/1972,95.4,511222417.0,-183891.0,,1972-07-29
Epitácio Pessoa,30/07/1972,95.4,511038525.0,-183892.0,,1972-07-30
Epitácio Pessoa,31/07/1972,95.4,510854633.0,-183892.0,,1972-07-31
Epitácio Pessoa,01/08/1972,91.78,377846134.0,-133008499.0,,1972-08-01
Epitácio Pessoa,02/08/1972,91.69,535680000.0,-353506.29,,1972-08-02
Epitácio Pessoa,03/08/1972,91.61,535680000.0,-353506.29,,1972-08-03
Epitácio Pessoa,04/08/1972,100.0,535680000.0,37747159.98,,1972-08-04
Epitácio Pessoa,05/08/1972,100.0,535680000.0,-399999.3,,1972-08-05
Epitácio Pessoa,06/08/1972,91.52,535680000.0,-37700666.97,,1972-08-06
Epitácio Pessoa,07/08/1972,91.44,535680000.0,-353506.29,,1972-08-07
Epitácio Pessoa,08/08/1972,91.35,535680000.0,-353506.29,,1972-08-08
Epitácio Pessoa,09/08/1972,91.26,535680000.0,-353506.29,,1972-08-09
Epitácio Pessoa,10/08/1972,91.18,535680000.0,-353506.29,,1972-08-10
Epitácio Pessoa,11/08/1972,91.18,535680000.0,0.0,,1972-08-11
Epitácio Pessoa,12/08/1972,91.09,535680000.0,-353506.29,,1972-08-12
Epitácio Pessoa,13/08/1972,91.09,535680000.0,0.0,,1972-08-13
Epitácio Pessoa,14/08/1972,91.09,535680000.0,0.0,,1972-08-14
Epitácio Pessoa,15/08/1972,91.01,535680000.0,-353506.29,,1972-08-15
Epitácio Pessoa,16/08/1972,91.01,535680000.0,0.0,,1972-08-16
Epitácio Pessoa,17/08/1972,91.18,535680000.0,707012.58,,1972-08-17
Epitácio Pessoa,18/08/1972,91.52,535680000.0,1414025.16,,1972-08-18
Epitácio Pessoa,19/08/1972,91.52,535680000.0,0.0,,1972-08-19
Epitácio Pessoa,20/08/1972,91.61,535680000.0,353506.29,,1972-08-20
Epitácio Pessoa,21/08/1972,91.61,535680000.0,0.0,,1972-08-21
Epitácio Pessoa,22/08/1972,91.69,535680000.0,353506.29,,1972-08-22
Epitácio Pessoa,23/08/1972,91.61,535680000.0,-353506.29,,1972-08-23
Epitácio Pessoa,24/08/1972,91.52,535680000.0,-353506.29,,1972-08-24
Epitácio Pessoa,25/08/1972,91.52,535680000.0,0.0,,1972-08-25
Epitácio Pessoa,26/08/1972,91.44,535680000.0,-353506.29,,1972-08-26
Epitácio Pessoa,27/08/1972,91.44,535680000.0,0.0,,1972-08-27
Epitácio Pessoa,28/08/1972,91.61,535680000.0,707012.58,,1972-08-28
Epitácio Pessoa,29/08/1972,91.61,535680000.0,0.0,,1972-08-29
Epitácio Pessoa,30/08/1972,91.52,535680000.0,-353506.29,,1972-08-30
Epitácio Pessoa,31/08/1972,91.44,535680000.0,-353506.29,,1972-08-31
Epitácio Pessoa,01/09/1972,95.2,509935175.0,133503066.16,,1972-09-01
Epitácio Pessoa,02/09/1972,95.2,509751284.0,-183891.0,,1972-09-02
Epitácio Pessoa,03/09/1972,95.2,509751284.0,0.0,,1972-09-03
Epitácio Pessoa,04/09/1972,95.1,509567392.0,-183892.0,,1972-09-04
Epitácio Pessoa,05/09/1972,95.1,509383500.0,-183892.0,,1972-09-05
Epitácio Pessoa,06/09/1972,95.1,509199609.0,-183891.0,,1972-09-06
Epitácio Pessoa,07/09/1972,95.0,509015717.0,-183892.0,,1972-09-07
Epitácio Pessoa,08/09/1972,95.0,508831826.0,-183891.0,,1972-09-08
Epitácio Pessoa,09/09/1972,95.0,508831826.0,0.0,,1972-09-09
Epitácio Pessoa,10/09/1972,95.0,508647934.0,-183892.0,,1972-09-10
Epitácio Pessoa,11/09/1972,94.9,508464042.0,-183892.0,,1972-09-11
Epitácio Pessoa,12/09/1972,94.9,508280151.0,-183891.0,,1972-09-12
Epitácio Pessoa,13/09/1972,94.9,508096259.0,-183892.0,,1972-09-13
Epitácio Pessoa,14/09/1972,94.9,508096259.0,0.0,,1972-09-14
Epitácio Pessoa,15/09/1972,94.8,507912368.0,-183891.0,,1972-09-15
Epitácio Pessoa,16/09/1972,94.8,507728476.0,-183892.0,,1972-09-16
Epitácio Pessoa,17/09/1972,94.7,507544584.0,-183892.0,,1972-09-17
Epitácio Pessoa,18/09/1972,94.7,507360693.0,-183891.0,,1972-09-18
Epitácio Pessoa,19/09/1972,94.7,507176801.0,-183892.0,,1972-09-19
Epitácio Pessoa,20/09/1972,94.6,506992910.0,-183891.0,,1972-09-20
Epitácio Pessoa,21/09/1972,94.6,506809018.0,-183892.0,,1972-09-21
Epitácio Pessoa,22/09/1972,94.6,506809018.0,0.0,,1972-09-22
Epitácio Pessoa,23/09/1972,94.6,506625126.0,-183892.0,,1972-09-23
Epitácio Pessoa,24/09/1972,94.5,506441235.0,-183891.0,,1972-09-24
Epitácio Pessoa,25/09/1972,94.5,506073452.0,-367783.0,,1972-09-25
Epitácio Pessoa,26/09/1972,94.4,505889560.0,-183892.0,,1972-09-26
Epitácio Pessoa,27/09/1972,94.4,505705668.0,-183892.0,,1972-09-27
Epitácio Pessoa,28/09/1972,94.4,505521777.0,-183891.0,,1972-09-28
Epitácio Pessoa,29/09/1972,94.3,505337885.0,-183892.0,,1972-09-29
Epitácio Pessoa,01/10/1972,74.2,397369725.0,0.0,,1972-10-01
Epitácio Pessoa,02/10/1972,94.3,504970102.0,107600377.0,,1972-10-02
Epitácio Pessoa,03/10/1972,94.2,504786210.0,-183892.0,,1972-10-03
Epitácio Pessoa,04/10/1972,94.2,504602319.0,-183891.0,,1972-10-04
Epitácio Pessoa,05/10/1972,94.2,504418427.0,-183892.0,,1972-10-05
Epitácio Pessoa,06/10/1972,94.1,504234536.0,-183891.0,,1972-10-06
Epitácio Pessoa,07/10/1972,94.1,504234536.0,0.0,,1972-10-07
Epitácio Pessoa,08/10/1972,94.1,504050644.0,-183892.0,,1972-10-08
Epitácio Pessoa,09/10/1972,94.1,503866752.0,-183892.0,,1972-10-09
Epitácio Pessoa,10/10/1972,94.0,503682861.0,-183891.0,,1972-10-10
Epitácio Pessoa,11/10/1972,94.0,503498969.0,-183892.0,,1972-10-11
Epitácio Pessoa,12/10/1972,94.0,503315078.0,-183891.0,,1972-10-12
Epitácio Pessoa,13/10/1972,93.9,503131186.0,-183892.0,,1972-10-13
Epitácio Pessoa,14/10/1972,93.9,502947294.0,-183892.0,,1972-10-14
Epitácio Pessoa,15/10/1972,93.9,502763403.0,-183891.0,,1972-10-15
Epitácio Pessoa,16/10/1972,93.8,502579511.0,-183892.0,,1972-10-16
Epitácio Pessoa,17/10/1972,93.8,502395619.0,-183892.0,,1972-10-17
Epitácio Pessoa,18/10/1972,93.8,502211728.0,-183891.0,,1972-10-18
Epitácio Pessoa,19/10/1972,93.7,502027836.0,-183892.0,,1972-10-19
Epitácio Pessoa,20/10/1972,93.7,501843945.0,-183891.0,,1972-10-20
Epitácio Pessoa,21/10/1972,93.6,501660053.0,-183892.0,,1972-10-21
Epitácio Pessoa,22/10/1972,93.6,501476161.0,-183892.0,,1972-10-22
Epitácio Pessoa,23/10/1972,93.6,501292270.0,-183891.0,,1972-10-23
Epitácio Pessoa,24/10/1972,93.5,501108378.0,-183892.0,,1972-10-24
Epitácio Pessoa,25/10/1972,93.5,500924487.0,-183891.0,,1972-10-25
Epitácio Pessoa,26/10/1972,93.5,500740595.0,-183892.0,,1972-10-26
Epitácio Pessoa,27/10/1972,93.4,500556703.0,-183892.0,,1972-10-27
Epitácio Pessoa,28/10/1972,93.4,500372812.0,-183891.0,,1972-10-28
Epitácio Pessoa,29/10/1972,93.4,500188920.0,-183892.0,,1972-10-29
Epitácio Pessoa,30/10/1972,93.3,500005029.0,-183891.0,,1972-10-30
Epitácio Pessoa,31/10/1972,93.3,499821137.0,-183892.0,,1972-10-31
Epitácio Pessoa,01/11/1972,93.3,499637245.0,-183892.0,,1972-11-01
Epitácio Pessoa,02/11/1972,93.2,499453354.0,-183891.0,,1972-11-02
Epitácio Pessoa,03/11/1972,93.2,499269462.0,-183892.0,,1972-11-03
Epitácio Pessoa,04/11/1972,93.2,499085571.0,-183891.0,,1972-11-04
Epitácio Pessoa,05/11/1972,93.1,498901679.0,-183892.0,,1972-11-05
Epitácio Pessoa,06/11/1972,93.1,498507597.0,-394082.0,,1972-11-06
Epitácio Pessoa,07/11/1972,93.0,498113515.0,-394082.0,,1972-11-07
Epitácio Pessoa,08/11/1972,92.9,497719434.0,-394081.0,,1972-11-08
Epitácio Pessoa,09/11/1972,92.8,497325352.0,-394082.0,,1972-11-09
Epitácio Pessoa,10/11/1972,92.8,496931270.0,-394082.0,,1972-11-10
Epitácio Pessoa,11/11/1972,92.7,496537188.0,-394082.0,,1972-11-11
Epitácio Pessoa,12/11/1972,92.6,496143106.0,-394082.0,,1972-11-12
Epitácio Pessoa,13/11/1972,92.5,495749025.0,-394081.0,,1972-11-13
Epitácio Pessoa,14/11/1972,92.5,495354943.0,-394082.0,,1972-11-14
Epitácio Pessoa,15/11/1972,92.4,494960861.0,-394082.0,,1972-11-15
Epitácio Pessoa,16/11/1972,92.3,494566779.0,-394082.0,,1972-11-16
Epitácio Pessoa,17/11/1972,92.3,494172697.0,-394082.0,,1972-11-17
Epitácio Pessoa,18/11/1972,92.2,493778616.0,-394081.0,,1972-11-18
Epitácio Pessoa,19/11/1972,92.1,493384534.0,-394082.0,,1972-11-19
Epitácio Pessoa,20/11/1972,92.0,492990452.0,-394082.0,,1972-11-20
Epitácio Pessoa,21/11/1972,92.0,492596370.0,-394082.0,,1972-11-21
Epitácio Pessoa,22/11/1972,91.9,492202288.0,-394082.0,,1972-11-22
Epitácio Pessoa,23/11/1972,91.8,491808207.0,-394081.0,,1972-11-23
Epitácio Pessoa,24/11/1972,91.7,491414125.0,-394082.0,,1972-11-24
Epitácio Pessoa,25/11/1972,91.7,491020043.0,-394082.0,,1972-11-25
Epitácio Pessoa,26/11/1972,91.6,490625961.0,-394082.0,,1972-11-26
Epitácio Pessoa,27/11/1972,91.5,490231880.0,-394081.0,,1972-11-27
Epitácio Pessoa,28/11/1972,91.4,489837798.0,-394082.0,,1972-11-28
Epitácio Pessoa,29/11/1972,91.4,489443716.0,-394082.0,,1972-11-29
Epitácio Pessoa,30/11/1972,91.3,489049634.0,-394082.0,,1972-11-30
Epitácio Pessoa,01/12/1972,91.2,488655552.0,-394082.0,,1972-12-01
Epitácio Pessoa,02/12/1972,91.1,488261471.0,-394081.0,,1972-12-02
Epitácio Pessoa,03/12/1972,91.1,487867389.0,-394082.0,,1972-12-03
Epitácio Pessoa,04/12/1972,91.0,487473307.0,-394082.0,,1972-12-04
Epitácio Pessoa,05/12/1972,90.9,487079225.0,-394082.0,,1972-12-05
Epitácio Pessoa,06/12/1972,90.9,486685143.0,-394082.0,,1972-12-06
Epitácio Pessoa,07/12/1972,90.8,486291062.0,-394081.0,,1972-12-07
Epitácio Pessoa,08/12/1972,90.7,485896980.0,-394082.0,,1972-12-08
Epitácio Pessoa,09/12/1972,90.6,485502898.0,-394082.0,,1972-12-09
Epitácio Pessoa,10/12/1972,90.6,485108816.0,-394082.0,,1972-12-10
Epitácio Pessoa,11/12/1972,90.5,484714734.0,-394082.0,,1972-12-11
Epitácio Pessoa,12/12/1972,90.4,484320653.0,-394081.0,,1972-12-12
Epitácio Pessoa,13/12/1972,90.3,483926571.0,-394082.0,,1972-12-13
Epitácio Pessoa,14/12/1972,90.3,483532489.0,-394082.0,,1972-12-14
Epitácio Pessoa,15/12/1972,90.2,483138407.0,-394082.0,,1972-12-15
Epitácio Pessoa,16/12/1972,90.1,482744325.0,-394082.0,,1972-12-16
Epitácio Pessoa,17/12/1972,90.0,482350244.0,-394081.0,,1972-12-17
Epitácio Pessoa,18/12/1972,95.1,509383500.0,27033256.0,,1972-12-18
Epitácio Pessoa,19/12/1972,89.9,481562080.0,-27821420.0,,1972-12-19
Epitácio Pessoa,20/12/1972,92.5,495354943.0,13792863.0,,1972-12-20
Epitácio Pessoa,21/12/1972,93.3,500005029.0,4650086.0,,1972-12-21
Epitácio Pessoa,22/12/1972,93.9,502763403.0,2758374.0,,1972-12-22
Epitácio Pessoa,23/12/1972,93.9,502763403.0,0.0,,1972-12-23
Epitácio Pessoa,24/12/1972,93.9,502763403.0,0.0,,1972-12-24
Epitácio Pessoa,25/12/1972,93.9,502763403.0,0.0,,1972-12-25
Epitácio Pessoa,26/12/1972,93.9,502763403.0,0.0,,1972-12-26
Epitácio Pessoa,27/12/1972,93.9,502763403.0,0.0,,1972-12-27
Epitácio Pessoa,28/12/1972,93.9,502763403.0,0.0,,1972-12-28
Epitácio Pessoa,29/12/1972,93.8,502579511.0,-183892.0,,1972-12-29
Epitácio Pessoa,30/12/1972,93.8,502395619.0,-183892.0,,1972-12-30
Epitácio Pessoa,01/01/1973,94.4,505521777.0,3310049.0,,1973-01-01
Epitácio Pessoa,02/01/1973,95.0,508647934.0,3126157.0,,1973-01-02
Epitácio Pessoa,03/01/1973,94.9,508464042.0,-183892.0,,1973-01-03
Epitácio Pessoa,04/01/1973,94.9,508464042.0,0.0,,1973-01-04
Epitácio Pessoa,05/01/1973,94.9,508280151.0,-183891.0,,1973-01-05
Epitácio Pessoa,06/01/1973,94.9,508096259.0,-183892.0,,1973-01-06
Epitácio Pessoa,07/01/1973,94.9,508096259.0,0.0,,1973-01-07
Epitácio Pessoa,08/01/1973,94.9,508096259.0,0.0,,1973-01-08
Epitácio Pessoa,09/01/1973,94.8,507912368.0,-183891.0,,1973-01-09
Epitácio Pessoa,10/01/1973,94.8,507728476.0,-183892.0,,1973-01-10
Epitácio Pessoa,11/01/1973,94.8,507728476.0,0.0,,1973-01-11
Epitácio Pessoa,12/01/1973,94.8,507728476.0,0.0,,1973-01-12
Epitácio Pessoa,13/01/1973,94.8,507728476.0,0.0,,1973-01-13
Epitácio Pessoa,14/01/1973,94.8,507728476.0,0.0,,1973-01-14
Epitácio Pessoa,15/01/1973,94.7,507544584.0,-183892.0,,1973-01-15
Epitácio Pessoa,16/01/1973,94.9,508280151.0,735567.0,,1973-01-16
Epitácio Pessoa,17/01/1973,94.9,508464042.0,183891.0,,1973-01-17
Epitácio Pessoa,18/01/1973,94.9,508464042.0,0.0,,1973-01-18
Epitácio Pessoa,19/01/1973,94.9,508464042.0,0.0,,1973-01-19
Epitácio Pessoa,20/01/1973,94.9,508280151.0,-183891.0,,1973-01-20
Epitácio Pessoa,21/01/1973,94.9,508280151.0,0.0,,1973-01-21
Epitácio Pessoa,22/01/1973,94.9,508096259.0,-183892.0,,1973-01-22
Epitácio Pessoa,23/01/1973,94.8,507912368.0,-183891.0,,1973-01-23
Epitácio Pessoa,24/01/1973,94.8,507728476.0,-183892.0,,1973-01-24
Epitácio Pessoa,25/01/1973,94.7,507544584.0,-183892.0,,1973-01-25
Epitácio Pessoa,26/01/1973,94.7,507360693.0,-183891.0,,1973-01-26
Epitácio Pessoa,27/01/1973,94.7,507360693.0,0.0,,1973-01-27
Epitácio Pessoa,28/01/1973,94.7,507176801.0,-183892.0,,1973-01-28
Epitácio Pessoa,29/01/1973,94.7,507176801.0,0.0,,1973-01-29
Epitácio Pessoa,30/01/1973,94.6,506992910.0,-183891.0,,1973-01-30
Epitácio Pessoa,31/01/1973,94.6,506809018.0,-183892.0,,1973-01-31
Epitácio Pessoa,01/02/1973,94.6,506625126.0,-183892.0,,1973-02-01
Epitácio Pessoa,02/02/1973,94.5,506441235.0,-183891.0,,1973-02-02
Epitácio Pessoa,03/02/1973,94.5,506257343.0,-183892.0,,1973-02-03
Epitácio Pessoa,04/02/1973,94.5,506073452.0,-183891.0,,1973-02-04
Epitácio Pessoa,05/02/1973,94.4,505889560.0,-183892.0,,1973-02-05
Epitácio Pessoa,06/02/1973,94.4,505705668.0,-183892.0,,1973-02-06
Epitácio Pessoa,07/02/1973,94.4,505521777.0,-183891.0,,1973-02-07
Epitácio Pessoa,08/02/1973,94.3,505337885.0,-183892.0,,1973-02-08
Epitácio Pessoa,09/02/1973,94.3,505153994.0,-183891.0,,1973-02-09
Epitácio Pessoa,10/02/1973,94.3,505153994.0,0.0,,1973-02-10
Epitácio Pessoa,11/02/1973,94.3,505153994.0,0.0,,1973-02-11
Epitácio Pessoa,12/02/1973,94.3,504970102.0,-183892.0,,1973-02-12
Epitácio Pessoa,13/02/1973,94.2,504786210.0,-183892.0,,1973-02-13
Epitácio Pessoa,14/02/1973,94.2,504602319.0,-183891.0,,1973-02-14
Epitácio Pessoa,15/02/1973,94.2,504418427.0,-183892.0,,1973-02-15
Epitácio Pessoa,16/02/1973,94.1,504234536.0,-183891.0,,1973-02-16
Epitácio Pessoa,17/02/1973,94.1,504050644.0,-183892.0,,1973-02-17
Epitácio Pessoa,18/02/1973,94.1,503866752.0,-183892.0,,1973-02-18
Epitácio Pessoa,19/02/1973,94.0,503682861.0,-183891.0,,1973-02-19
Epitácio Pessoa,20/02/1973,80.3,429937365.0,-73745496.0,,1973-02-20
Epitácio Pessoa,21/02/1973,94.0,503315078.0,73377713.0,,1973-02-21
Epitácio Pessoa,22/02/1973,94.0,503315078.0,0.0,,1973-02-22
Epitácio Pessoa,23/02/1973,94.0,503315078.0,0.0,,1973-02-23
Epitácio Pessoa,24/02/1973,94.0,503498969.0,183891.0,,1973-02-24
Epitácio Pessoa,25/02/1973,94.0,503498969.0,0.0,,1973-02-25
Epitácio Pessoa,26/02/1973,94.0,503682861.0,183892.0,,1973-02-26
Epitácio Pessoa,27/02/1973,94.1,504050644.0,367783.0,,1973-02-27
Epitácio Pessoa,28/02/1973,94.1,504050644.0,0.0,,1973-02-28
Epitácio Pessoa,01/03/1973,94.1,504050644.0,0.0,,1973-03-01
Epitácio Pessoa,02/03/1973,94.1,503866752.0,-183892.0,,1973-03-02
Epitácio Pessoa,03/03/1973,94.0,503682861.0,-183891.0,,1973-03-03
Epitácio Pessoa,04/03/1973,94.0,503498969.0,-183892.0,,1973-03-04
Epitácio Pessoa,05/03/1973,94.0,503315078.0,-183891.0,,1973-03-05
Epitácio Pessoa,06/03/1973,93.9,503131186.0,-183892.0,,1973-03-06
Epitácio Pessoa,07/03/1973,93.9,502947294.0,-183892.0,,1973-03-07
Epitácio Pessoa,08/03/1973,94.0,503315078.0,367784.0,,1973-03-08
Epitácio Pessoa,09/03/1973,94.0,503315078.0,0.0,,1973-03-09
Epitácio Pessoa,10/03/1973,94.0,503315078.0,0.0,,1973-03-10
Epitácio Pessoa,11/03/1973,94.0,503315078.0,0.0,,1973-03-11
Epitácio Pessoa,12/03/1973,94.0,503315078.0,0.0,,1973-03-12
Epitácio Pessoa,13/03/1973,94.3,505337885.0,2022807.0,,1973-03-13
Epitácio Pessoa,14/03/1973,94.4,505889560.0,551675.0,,1973-03-14
Epitácio Pessoa,15/03/1973,94.6,506809018.0,919458.0,,1973-03-15
Epitácio Pessoa,16/03/1973,95.0,508831826.0,2022808.0,,1973-03-16
Epitácio Pessoa,17/03/1973,95.0,509015717.0,183891.0,,1973-03-17
Epitácio Pessoa,18/03/1973,95.1,509199609.0,183892.0,,1973-03-18
Epitácio Pessoa,19/03/1973,95.1,509383500.0,183891.0,,1973-03-19
Epitácio Pessoa,20/03/1973,95.1,509383500.0,0.0,,1973-03-20
Epitácio Pessoa,21/03/1973,95.1,509383500.0,0.0,,1973-03-21
Epitácio Pessoa,22/03/1973,95.1,509383500.0,0.0,,1973-03-22
Epitácio Pessoa,23/03/1973,95.2,510119067.0,735567.0,,1973-03-23
Epitácio Pessoa,24/03/1973,95.4,510854633.0,735566.0,,1973-03-24
Epitácio Pessoa,25/03/1973,95.5,511406308.0,551675.0,,1973-03-25
Epitácio Pessoa,26/03/1973,97.6,522623696.0,11217388.0,,1973-03-26
Epitácio Pessoa,27/03/1973,94.2,504418427.0,-18205269.0,,1973-03-27
Epitácio Pessoa,28/03/1973,94.2,504786210.0,367783.0,,1973-03-28
Epitácio Pessoa,29/03/1973,94.3,504970102.0,183892.0,,1973-03-29
Epitácio Pessoa,30/03/1973,94.3,504970102.0,0.0,,1973-03-30
Epitácio Pessoa,31/03/1973,94.3,504970102.0,0.0,,1973-03-31
Epitácio Pessoa,01/04/1973,97.7,523359262.0,18389160.0,,1973-04-01
Epitácio Pessoa,02/04/1973,97.7,523359262.0,0.0,,1973-04-02
Epitácio Pessoa,03/04/1973,97.7,523359262.0,0.0,,1973-04-03
Epitácio Pessoa,04/04/1973,97.7,523175371.0,-183891.0,,1973-04-04
Epitácio Pessoa,05/04/1973,97.7,523175371.0,0.0,,1973-04-05
Epitácio Pessoa,06/04/1973,97.6,522991479.0,-183892.0,,1973-04-06
Epitácio Pessoa,07/04/1973,98.2,525933745.0,2942266.0,,1973-04-07
Epitácio Pessoa,08/04/1973,98.9,529795469.0,3861724.0,,1973-04-08
Epitácio Pessoa,09/04/1973,99.0,530531035.0,735566.0,,1973-04-09
Epitácio Pessoa,10/04/1973,99.1,531082710.0,551675.0,,1973-04-10
Epitácio Pessoa,11/04/1973,99.2,531266601.0,183891.0,,1973-04-11
Epitácio Pessoa,12/04/1973,99.3,532002168.0,735567.0,,1973-04-12
Epitácio Pessoa,13/04/1973,99.8,534760542.0,2758374.0,,1973-04-13
Epitácio Pessoa,14/04/1973,100.0,535680000.0,919458.0,,1973-04-14
Epitácio Pessoa,15/04/1973,100.0,535680000.0,0.0,,1973-04-15
Epitácio Pessoa,16/04/1973,100.0,535680000.0,0.0,,1973-04-16
Epitácio Pessoa,17/04/1973,100.0,535680000.0,0.0,,1973-04-17
Epitácio Pessoa,18/04/1973,100.0,535680000.0,0.0,,1973-04-18
Epitácio Pessoa,19/04/1973,100.0,535680000.0,0.0,,1973-04-19
Epitácio Pessoa,20/04/1973,100.0,535680000.0,0.0,,1973-04-20
Epitácio Pessoa,21/04/1973,100.0,535680000.0,0.0,,1973-04-21
Epitácio Pessoa,22/04/1973,100.0,535680000.0,0.0,,1973-04-22
Epitácio Pessoa,23/04/1973,100.0,535680000.0,0.0,,1973-04-23
Epitácio Pessoa,24/04/1973,100.0,535680000.0,0.0,,1973-04-24
Epitácio Pessoa,25/04/1973,100.0,535680000.0,0.0,,1973-04-25
Epitácio Pessoa,26/04/1973,100.0,535680000.0,0.0,,1973-04-26
Epitácio Pessoa,27/04/1973,100.0,535680000.0,0.0,,1973-04-27
Epitácio Pessoa,28/04/1973,100.0,535680000.0,0.0,,1973-04-28
Epitácio Pessoa,29/04/1973,100.0,535680000.0,0.0,,1973-04-29
Epitácio Pessoa,30/04/1973,100.0,535680000.0,0.0,,1973-04-30
Epitácio Pessoa,01/05/1973,100.0,535680000.0,0.0,,1973-05-01
Epitácio Pessoa,02/05/1973,100.0,535680000.0,0.0,,1973-05-02
Epitácio Pessoa,03/05/1973,100.0,535680000.0,0.0,,1973-05-03
Epitácio Pessoa,04/05/1973,100.0,535680000.0,0.0,,1973-05-04
Epitácio Pessoa,05/05/1973,100.0,535680000.0,0.0,,1973-05-05
Epitácio Pessoa,06/05/1973,100.0,535680000.0,0.0,,1973-05-06
Epitácio Pessoa,07/05/1973,100.0,535680000.0,0.0,,1973-05-07
Epitácio Pessoa,08/05/1973,100.0,535680000.0,0.0,,1973-05-08
Epitácio Pessoa,09/05/1973,100.0,535680000.0,0.0,,1973-05-09
Epitácio Pessoa,10/05/1973,100.0,535680000.0,0.0,,1973-05-10
Epitácio Pessoa,11/05/1973,100.0,535680000.0,0.0,,1973-05-11
Epitácio Pessoa,12/05/1973,100.0,535680000.0,0.0,,1973-05-12
Epitácio Pessoa,13/05/1973,100.0,535680000.0,0.0,,1973-05-13
Epitácio Pessoa,14/05/1973,100.0,535680000.0,0.0,,1973-05-14
Epitácio Pessoa,15/05/1973,100.0,535680000.0,0.0,,1973-05-15
Epitácio Pessoa,16/05/1973,100.0,535680000.0,0.0,,1973-05-16
Epitácio Pessoa,17/05/1973,100.0,535680000.0,0.0,,1973-05-17
Epitácio Pessoa,18/05/1973,100.0,535680000.0,0.0,,1973-05-18
Epitácio Pessoa,19/05/1973,100.0,535680000.0,0.0,,1973-05-19
Epitácio Pessoa,20/05/1973,100.0,535680000.0,0.0,,1973-05-20
Epitácio Pessoa,21/05/1973,100.0,535680000.0,0.0,,1973-05-21
Epitácio Pessoa,22/05/1973,100.0,535680000.0,0.0,,1973-05-22
Epitácio Pessoa,23/05/1973,100.0,535680000.0,0.0,,1973-05-23
Epitácio Pessoa,24/05/1973,100.0,535680000.0,0.0,,1973-05-24
Epitácio Pessoa,25/05/1973,100.0,535680000.0,0.0,,1973-05-25
Epitácio Pessoa,26/05/1973,100.0,535680000.0,0.0,,1973-05-26
Epitácio Pessoa,27/05/1973,100.0,535496108.0,-183892.0,,1973-05-27
Epitácio Pessoa,28/05/1973,99.9,535312217.0,-183891.0,,1973-05-28
Epitácio Pessoa,29/05/1973,99.9,535128325.0,-183892.0,,1973-05-29
Epitácio Pessoa,30/05/1973,99.9,534944434.0,-183891.0,,1973-05-30
Epitácio Pessoa,31/05/1973,99.8,534760542.0,-183892.0,,1973-05-31
Epitácio Pessoa,01/06/1973,99.8,534576650.0,-183892.0,,1973-06-01
Epitácio Pessoa,02/06/1973,99.8,534392759.0,-183891.0,,1973-06-02
Epitácio Pessoa,03/06/1973,99.7,534208867.0,-183892.0,,1973-06-03
Epitácio Pessoa,04/06/1973,99.7,534024976.0,-183891.0,,1973-06-04
Epitácio Pessoa,05/06/1973,99.7,533841084.0,-183892.0,,1973-06-05
Epitácio Pessoa,06/06/1973,99.6,533657192.0,-183892.0,,1973-06-06
Epitácio Pessoa,07/06/1973,99.6,533473301.0,-183891.0,,1973-06-07
Epitácio Pessoa,08/06/1973,99.6,533473301.0,0.0,,1973-06-08
Epitácio Pessoa,09/06/1973,99.6,533473301.0,0.0,,1973-06-09
Epitácio Pessoa,10/06/1973,99.6,533473301.0,0.0,,1973-06-10
Epitácio Pessoa,11/06/1973,99.6,533289409.0,-183892.0,,1973-06-11
Epitácio Pessoa,12/06/1973,99.8,534392759.0,1103350.0,,1973-06-12
Epitácio Pessoa,13/06/1973,99.5,532921626.0,-1471133.0,,1973-06-13
Epitácio Pessoa,14/06/1973,99.5,532921626.0,0.0,,1973-06-14
Epitácio Pessoa,15/06/1973,99.5,532921626.0,0.0,,1973-06-15
Epitácio Pessoa,16/06/1973,99.5,532737734.0,-183892.0,,1973-06-16
Epitácio Pessoa,17/06/1973,99.5,532737734.0,0.0,,1973-06-17
Epitácio Pessoa,18/06/1973,99.5,532737734.0,0.0,,1973-06-18
Epitácio Pessoa,19/06/1973,99.4,532553843.0,-183891.0,,1973-06-19
Epitácio Pessoa,20/06/1973,99.4,532369951.0,-183892.0,,1973-06-20
Epitácio Pessoa,21/06/1973,99.4,532369951.0,0.0,,1973-06-21
Epitácio Pessoa,22/06/1973,99.3,532186060.0,-183891.0,,1973-06-22
Epitácio Pessoa,23/06/1973,99.3,532186060.0,0.0,,1973-06-23
Epitácio Pessoa,24/06/1973,99.3,532002168.0,-183892.0,,1973-06-24
Epitácio Pessoa,25/06/1973,99.3,532002168.0,0.0,,1973-06-25
Epitácio Pessoa,26/06/1973,99.3,531818276.0,-183892.0,,1973-06-26
Epitácio Pessoa,27/06/1973,99.3,531818276.0,0.0,,1973-06-27
Epitácio Pessoa,28/06/1973,99.2,531634385.0,-183891.0,,1973-06-28
Epitácio Pessoa,29/06/1973,99.2,531634385.0,0.0,,1973-06-29
Epitácio Pessoa,30/06/1973,99.2,531450493.0,-183892.0,,1973-06-30
Epitácio Pessoa,01/07/1973,99.2,531450493.0,0.0,,1973-07-01
Epitácio Pessoa,02/07/1973,99.2,531266601.0,-183892.0,,1973-07-02
Epitácio Pessoa,03/07/1973,99.1,531082710.0,-183891.0,,1973-07-03
Epitácio Pessoa,04/07/1973,99.1,530898818.0,-183892.0,,1973-07-04
Epitácio Pessoa,05/07/1973,99.1,530898818.0,0.0,,1973-07-05
Epitácio Pessoa,06/07/1973,99.1,530714927.0,-183891.0,,1973-07-06
Epitácio Pessoa,07/07/1973,99.1,530714927.0,0.0,,1973-07-07
Epitácio Pessoa,08/07/1973,99.0,530531035.0,-183892.0,,1973-07-08
Epitácio Pessoa,09/07/1973,99.0,530531035.0,0.0,,1973-07-09
Epitácio Pessoa,10/07/1973,99.0,530347143.0,-183892.0,,1973-07-10
Epitácio Pessoa,11/07/1973,99.0,530347143.0,0.0,,1973-07-11
Epitácio Pessoa,12/07/1973,99.0,530163252.0,-183891.0,,1973-07-12
Epitácio Pessoa,13/07/1973,99.0,530163252.0,0.0,,1973-07-13
Epitácio Pessoa,14/07/1973,98.9,529979360.0,-183892.0,,1973-07-14
Epitácio Pessoa,15/07/1973,98.9,529979360.0,0.0,,1973-07-15
Epitácio Pessoa,16/07/1973,98.9,529795469.0,-183891.0,,1973-07-16
Epitácio Pessoa,17/07/1973,98.9,529795469.0,0.0,,1973-07-17
Epitácio Pessoa,18/07/1973,98.9,529611577.0,-183892.0,,1973-07-18
Epitácio Pessoa,19/07/1973,98.9,529611577.0,0.0,,1973-07-19
Epitácio Pessoa,20/07/1973,98.8,529427685.0,-183892.0,,1973-07-20
Epitácio Pessoa,21/07/1973,98.8,529427685.0,0.0,,1973-07-21
Epitácio Pessoa,22/07/1973,98.8,529243794.0,-183891.0,,1973-07-22
Epitácio Pessoa,23/07/1973,99.0,530163252.0,919458.0,,1973-07-23
Epitácio Pessoa,24/07/1973,99.0,530163252.0,0.0,,1973-07-24
Epitácio Pessoa,25/07/1973,98.9,529979360.0,-183892.0,,1973-07-25
Epitácio Pessoa,26/07/1973,98.9,529795469.0,-183891.0,,1973-07-26
Epitácio Pessoa,27/07/1973,98.9,529611577.0,-183892.0,,1973-07-27
Epitácio Pessoa,28/07/1973,98.8,529427685.0,-183892.0,,1973-07-28
Epitácio Pessoa,29/07/1973,98.8,529243794.0,-183891.0,,1973-07-29
Epitácio Pessoa,30/07/1973,98.8,529059902.0,-183892.0,,1973-07-30
Epitácio Pessoa,31/07/1973,98.7,528876011.0,-183891.0,,1973-07-31
Epitácio Pessoa,01/08/1973,98.7,528876011.0,0.0,,1973-08-01
Epitácio Pessoa,02/08/1973,98.7,528692119.0,-183892.0,,1973-08-02
Epitácio Pessoa,03/08/1973,98.7,528692119.0,0.0,,1973-08-03
Epitácio Pessoa,04/08/1973,98.7,528876011.0,183892.0,,1973-08-04
Epitácio Pessoa,05/08/1973,98.7,528876011.0,0.0,,1973-08-05
Epitácio Pessoa,06/08/1973,98.8,529059902.0,183891.0,,1973-08-06
Epitácio Pessoa,07/08/1973,98.8,529059902.0,0.0,,1973-08-07
Epitácio Pessoa,08/08/1973,98.8,529059902.0,0.0,,1973-08-08
Epitácio Pessoa,09/08/1973,98.7,528876011.0,-183891.0,,1973-08-09
Epitácio Pessoa,10/08/1973,98.7,528692119.0,-183892.0,,1973-08-10
Epitácio Pessoa,11/08/1973,98.7,528508227.0,-183892.0,,1973-08-11
Epitácio Pessoa,12/08/1973,98.6,528324336.0,-183891.0,,1973-08-12
Epitácio Pessoa,13/08/1973,98.6,528140444.0,-183892.0,,1973-08-13
Epitácio Pessoa,14/08/1973,98.6,527956553.0,-183891.0,,1973-08-14
Epitácio Pessoa,15/08/1973,98.6,527956553.0,0.0,,1973-08-15
Epitácio Pessoa,16/08/1973,98.5,527772661.0,-183892.0,,1973-08-16
Epitácio Pessoa,17/08/1973,98.5,527588769.0,-183892.0,,1973-08-17
Epitácio Pessoa,18/08/1973,98.5,527588769.0,0.0,,1973-08-18
Epitácio Pessoa,19/08/1973,98.5,527404878.0,-183891.0,,1973-08-19
Epitácio Pessoa,20/08/1973,98.4,527220986.0,-183892.0,,1973-08-20
Epitácio Pessoa,21/08/1973,98.4,527037095.0,-183891.0,,1973-08-21
Epitácio Pessoa,22/08/1973,98.4,526853203.0,-183892.0,,1973-08-22
Epitácio Pessoa,23/08/1973,98.3,526669311.0,-183892.0,,1973-08-23
Epitácio Pessoa,24/08/1973,98.3,526485420.0,-183891.0,,1973-08-24
Epitácio Pessoa,25/08/1973,98.2,526301528.0,-183892.0,,1973-08-25
Epitácio Pessoa,26/08/1973,98.2,526117637.0,-183891.0,,1973-08-26
Epitácio Pessoa,27/08/1973,98.2,525933745.0,-183892.0,,1973-08-27
Epitácio Pessoa,28/08/1973,98.1,525749853.0,-183892.0,,1973-08-28
Epitácio Pessoa,29/08/1973,98.1,525565962.0,-183891.0,,1973-08-29
Epitácio Pessoa,30/08/1973,98.1,525382070.0,-183892.0,,1973-08-30
Epitácio Pessoa,31/08/1973,98.0,525198179.0,-183891.0,,1973-08-31
Epitácio Pessoa,01/09/1973,98.0,525198179.0,0.0,,1973-09-01
Epitácio Pessoa,02/09/1973,98.0,525014287.0,-183892.0,,1973-09-02
Epitácio Pessoa,03/09/1973,98.0,525014287.0,0.0,,1973-09-03
Epitácio Pessoa,04/09/1973,98.0,524830395.0,-183892.0,,1973-09-04
Epitácio Pessoa,05/09/1973,98.0,524830395.0,0.0,,1973-09-05
Epitácio Pessoa,06/09/1973,97.9,524646504.0,-183891.0,,1973-09-06
Epitácio Pessoa,07/09/1973,97.9,524646504.0,0.0,,1973-09-07
Epitácio Pessoa,08/09/1973,97.9,524462612.0,-183892.0,,1973-09-08
Epitácio Pessoa,09/09/1973,97.9,524462612.0,0.0,,1973-09-09
Epitácio Pessoa,10/09/1973,97.9,524278720.0,-183892.0,,1973-09-10
Epitácio Pessoa,11/09/1973,97.8,524094829.0,-183891.0,,1973-09-11
Epitácio Pessoa,12/09/1973,97.8,524094829.0,0.0,,1973-09-12
Epitácio Pessoa,13/09/1973,97.8,523910937.0,-183892.0,,1973-09-13
Epitácio Pessoa,14/09/1973,97.8,523910937.0,0.0,,1973-09-14
Epitácio Pessoa,15/09/1973,97.8,523727046.0,-183891.0,,1973-09-15
Epitácio Pessoa,16/09/1973,97.8,523727046.0,0.0,,1973-09-16
Epitácio Pessoa,17/09/1973,97.7,523543154.0,-183892.0,,1973-09-17
Epitácio Pessoa,18/09/1973,97.7,523543154.0,0.0,,1973-09-18
Epitácio Pessoa,19/09/1973,97.7,523359262.0,-183892.0,,1973-09-19
Epitácio Pessoa,20/09/1973,97.7,523359262.0,0.0,,1973-09-20
Epitácio Pessoa,21/09/1973,97.7,523175371.0,-183891.0,,1973-09-21
Epitácio Pessoa,22/09/1973,97.6,522991479.0,-183892.0,,1973-09-22
Epitácio Pessoa,23/09/1973,97.6,522807588.0,-183891.0,,1973-09-23
Epitácio Pessoa,24/09/1973,97.6,522807588.0,0.0,,1973-09-24
Epitácio Pessoa,25/09/1973,97.6,522623696.0,-183892.0,,1973-09-25
Epitácio Pessoa,26/09/1973,97.5,522439804.0,-183892.0,,1973-09-26
Epitácio Pessoa,27/09/1973,97.5,522255913.0,-183891.0,,1973-09-27
Epitácio Pessoa,28/09/1973,97.5,522072021.0,-183892.0,,1973-09-28
Epitácio Pessoa,29/09/1973,97.4,521888130.0,-183891.0,,1973-09-29
Epitácio Pessoa,01/10/1973,97.4,521704238.0,0.0,,1973-10-01
Epitácio Pessoa,02/10/1973,97.4,521704238.0,0.0,,1973-10-02
Epitácio Pessoa,03/10/1973,97.7,523175371.0,1471133.0,,1973-10-03
Epitácio Pessoa,04/10/1973,97.8,523727046.0,551675.0,,1973-10-04
Epitácio Pessoa,05/10/1973,97.8,523910937.0,183891.0,,1973-10-05
Epitácio Pessoa,06/10/1973,97.8,523910937.0,0.0,,1973-10-06
Epitácio Pessoa,07/10/1973,97.8,523727046.0,-183891.0,,1973-10-07
Epitácio Pessoa,08/10/1973,97.8,523727046.0,0.0,,1973-10-08
Epitácio Pessoa,09/10/1973,97.7,523543154.0,-183892.0,,1973-10-09
Epitácio Pessoa,10/10/1973,97.7,523543154.0,0.0,,1973-10-10
Epitácio Pessoa,11/10/1973,97.7,523359262.0,-183892.0,,1973-10-11
Epitácio Pessoa,12/10/1973,97.7,523359262.0,0.0,,1973-10-12
Epitácio Pessoa,13/10/1973,97.7,523175371.0,-183891.0,,1973-10-13
Epitácio Pessoa,14/10/1973,97.6,522991479.0,-183892.0,,1973-10-14
Epitácio Pessoa,15/10/1973,97.6,522807588.0,-183891.0,,1973-10-15
Epitácio Pessoa,16/10/1973,97.6,522623696.0,-183892.0,,1973-10-16
Epitácio Pessoa,17/10/1973,97.5,522439804.0,-183892.0,,1973-10-17
Epitácio Pessoa,18/10/1973,97.5,522255913.0,-183891.0,,1973-10-18
Epitácio Pessoa,19/10/1973,97.5,522072021.0,-183892.0,,1973-10-19
Epitácio Pessoa,20/10/1973,97.4,521888130.0,-183891.0,,1973-10-20
Epitácio Pessoa,21/10/1973,97.4,521704238.0,-183892.0,,1973-10-21
Epitácio Pessoa,22/10/1973,97.4,521520346.0,-183892.0,,1973-10-22
Epitácio Pessoa,23/10/1973,97.3,521336455.0,-183891.0,,1973-10-23
Epitácio Pessoa,24/10/1973,97.3,521152563.0,-183892.0,,1973-10-24
Epitácio Pessoa,25/10/1973,97.3,520968672.0,-183891.0,,1973-10-25
Epitácio Pessoa,26/10/1973,97.2,520784780.0,-183892.0,,1973-10-26
Epitácio Pessoa,27/10/1973,97.2,520600888.0,-183892.0,,1973-10-27
Epitácio Pessoa,28/10/1973,97.2,520416997.0,-183891.0,,1973-10-28
Epitácio Pessoa,29/10/1973,97.1,520233105.0,-183892.0,,1973-10-29
Epitácio Pessoa,30/10/1973,97.1,520049214.0,-183891.0,,1973-10-30
Epitácio Pessoa,31/10/1973,97.0,519865322.0,-183892.0,,1973-10-31
Epitácio Pessoa,01/11/1973,97.0,519681430.0,-183892.0,,1973-11-01
Epitácio Pessoa,02/11/1973,97.0,519497539.0,-183891.0,,1973-11-02
Epitácio Pessoa,03/11/1973,96.9,519313647.0,-183892.0,,1973-11-03
Epitácio Pessoa,04/11/1973,96.9,519129756.0,-183891.0,,1973-11-04
Epitácio Pessoa,05/11/1973,96.9,518945864.0,-183892.0,,1973-11-05
Epitácio Pessoa,06/11/1973,96.8,518761972.0,-183892.0,,1973-11-06
Epitácio Pessoa,07/11/1973,96.8,518578081.0,-183891.0,,1973-11-07
Epitácio Pessoa,08/11/1973,96.8,518394189.0,-183892.0,,1973-11-08
Epitácio Pessoa,09/11/1973,96.7,518210298.0,-183891.0,,1973-11-09
Epitácio Pessoa,10/11/1973,96.7,518026406.0,-183892.0,,1973-11-10
Epitácio Pessoa,11/11/1973,96.7,517842514.0,-183892.0,,1973-11-11
Epitácio Pessoa,12/11/1973,96.6,517658623.0,-183891.0,,1973-11-12
Epitácio Pessoa,13/11/1973,96.6,517474731.0,-183892.0,,1973-11-13
Epitácio Pessoa,14/11/1973,96.6,517290840.0,-183891.0,,1973-11-14
Epitácio Pessoa,15/11/1973,96.5,517106948.0,-183892.0,,1973-11-15
Epitácio Pessoa,16/11/1973,96.5,516923056.0,-183892.0,,1973-11-16
Epitácio Pessoa,17/11/1973,96.5,516739165.0,-183891.0,,1973-11-17
Epitácio Pessoa,18/11/1973,96.4,516555273.0,-183892.0,,1973-11-18
Epitácio Pessoa,19/11/1973,96.4,516371381.0,-183892.0,,1973-11-19
Epitácio Pessoa,20/11/1973,96.4,516187490.0,-183891.0,,1973-11-20
Epitácio Pessoa,21/11/1973,96.3,516003598.0,-183892.0,,1973-11-21
Epitácio Pessoa,22/11/1973,96.3,515819707.0,-183891.0,,1973-11-22
Epitácio Pessoa,23/11/1973,96.3,515635815.0,-183892.0,,1973-11-23
Epitácio Pessoa,24/11/1973,96.2,515451923.0,-183892.0,,1973-11-24
Epitácio Pessoa,25/11/1973,96.2,515268032.0,-183891.0,,1973-11-25
Epitácio Pessoa,26/11/1973,96.2,515084140.0,-183892.0,,1973-11-26
Epitácio Pessoa,27/11/1973,96.1,514900249.0,-183891.0,,1973-11-27
Epitácio Pessoa,28/11/1973,96.1,514716357.0,-183892.0,,1973-11-28
Epitácio Pessoa,29/11/1973,96.1,514532465.0,-183892.0,,1973-11-29
Epitácio Pessoa,30/11/1973,96.0,514348574.0,-183891.0,,1973-11-30
Epitácio Pessoa,01/12/1973,96.0,514164682.0,-183892.0,,1973-12-01
Epitácio Pessoa,02/12/1973,95.9,513980791.0,-183891.0,,1973-12-02
Epitácio Pessoa,03/12/1973,95.9,513796899.0,-183892.0,,1973-12-03
Epitácio Pessoa,04/12/1973,95.9,513613007.0,-183892.0,,1973-12-04
Epitácio Pessoa,05/12/1973,95.8,513429116.0,-183891.0,,1973-12-05
Epitácio Pessoa,06/12/1973,95.8,513245224.0,-183892.0,,1973-12-06
Epitácio Pessoa,07/12/1973,95.8,513061333.0,-183891.0,,1973-12-07
Epitácio Pessoa,08/12/1973,95.7,512877441.0,-183892.0,,1973-12-08
Epitácio Pessoa,09/12/1973,95.7,512693549.0,-183892.0,,1973-12-09
Epitácio Pessoa,10/12/1973,95.7,512509658.0,-183891.0,,1973-12-10
Epitácio Pessoa,11/12/1973,95.6,512325766.0,-183892.0,,1973-12-11
Epitácio Pessoa,12/12/1973,95.6,512141875.0,-183891.0,,1973-12-12
Epitácio Pessoa,13/12/1973,95.6,511957983.0,-183892.0,,1973-12-13
Epitácio Pessoa,14/12/1973,95.5,511774091.0,-183892.0,,1973-12-14
Epitácio Pessoa,15/12/1973,95.5,511590200.0,-183891.0,,1973-12-15
Epitácio Pessoa,16/12/1973,95.5,511406308.0,-183892.0,,1973-12-16
Epitácio Pessoa,17/12/1973,95.4,511222417.0,-183891.0,,1973-12-17
Epitácio Pessoa,18/12/1973,95.4,511038525.0,-183892.0,,1973-12-18
Epitácio Pessoa,19/12/1973,95.4,510854633.0,-183892.0,,1973-12-19
Epitácio Pessoa,20/12/1973,95.3,510670742.0,-183891.0,,1973-12-20
Epitácio Pessoa,21/12/1973,95.4,511038525.0,367783.0,,1973-12-21
Epitácio Pessoa,22/12/1973,95.4,510854633.0,-183892.0,,1973-12-22
Epitácio Pessoa,23/12/1973,95.3,510670742.0,-183891.0,,1973-12-23
Epitácio Pessoa,24/12/1973,95.3,510486850.0,-183892.0,,1973-12-24
Epitácio Pessoa,25/12/1973,95.3,510302959.0,-183891.0,,1973-12-25
Epitácio Pessoa,26/12/1973,95.2,510119067.0,-183892.0,,1973-12-26
Epitácio Pessoa,27/12/1973,95.2,509935175.0,-183892.0,,1973-12-27
Epitácio Pessoa,28/12/1973,95.2,509751284.0,-183891.0,,1973-12-28
Epitácio Pessoa,29/12/1973,95.1,509567392.0,-183892.0,,1973-12-29
Epitácio Pessoa,30/12/1973,95.1,509383500.0,-183892.0,,1973-12-30
Epitácio Pessoa,01/01/1974,95.0,509015718.0,-183891.0,,1974-01-01
Epitácio Pessoa,02/01/1974,95.0,508831826.0,-183892.0,,1974-01-02
Epitácio Pessoa,03/01/1974,95.0,508647935.0,-183891.0,,1974-01-03
Epitácio Pessoa,04/01/1974,94.9,508464043.0,-183892.0,,1974-01-04
Epitácio Pessoa,05/01/1974,94.9,508280151.0,-183892.0,,1974-01-05
Epitácio Pessoa,06/01/1974,94.9,508096260.0,-183891.0,,1974-01-06
Epitácio Pessoa,07/01/1974,94.8,507912368.0,-183892.0,,1974-01-07
Epitácio Pessoa,08/01/1974,94.8,507728477.0,-183891.0,,1974-01-08
Epitácio Pessoa,09/01/1974,94.7,507544585.0,-183892.0,,1974-01-09
Epitácio Pessoa,10/01/1974,94.7,507360693.0,-183892.0,,1974-01-10
Epitácio Pessoa,11/01/1974,94.7,507176802.0,-183891.0,,1974-01-11
Epitácio Pessoa,12/01/1974,94.6,506992910.0,-183892.0,,1974-01-12
Epitácio Pessoa,13/01/1974,94.6,506809019.0,-183891.0,,1974-01-13
Epitácio Pessoa,14/01/1974,94.6,506625127.0,-183892.0,,1974-01-14
Epitácio Pessoa,15/01/1974,94.5,506441235.0,-183892.0,,1974-01-15
Epitácio Pessoa,16/01/1974,94.5,506441235.0,0.0,,1974-01-16
Epitácio Pessoa,17/01/1974,94.5,506073452.0,-367783.0,,1974-01-17
Epitácio Pessoa,18/01/1974,94.4,505889560.0,-183892.0,,1974-01-18
Epitácio Pessoa,19/01/1974,94.8,507912368.0,2022808.0,,1974-01-19
Epitácio Pessoa,20/01/1974,95.3,510302959.0,2390591.0,,1974-01-20
Epitácio Pessoa,21/01/1974,95.8,513061333.0,2758374.0,,1974-01-21
Epitácio Pessoa,22/01/1974,96.1,514716358.0,1655025.0,,1974-01-22
Epitácio Pessoa,23/01/1974,96.2,515084141.0,367783.0,,1974-01-23
Epitácio Pessoa,24/01/1974,96.2,515084141.0,0.0,,1974-01-24
Epitácio Pessoa,25/01/1974,96.2,515084141.0,0.0,,1974-01-25
Epitácio Pessoa,26/01/1974,96.1,514900249.0,-183892.0,,1974-01-26
Epitácio Pessoa,27/01/1974,96.1,514716358.0,-183891.0,,1974-01-27
Epitácio Pessoa,28/01/1974,96.1,514716358.0,0.0,,1974-01-28
Epitácio Pessoa,29/01/1974,96.1,514900249.0,183891.0,,1974-01-29
Epitácio Pessoa,30/01/1974,96.2,515451924.0,551675.0,,1974-01-30
Epitácio Pessoa,31/01/1974,98.1,525749854.0,10297930.0,,1974-01-31
Epitácio Pessoa,01/02/1974,98.1,525749853.0,-1.0,,1974-02-01
Epitácio Pessoa,02/02/1974,98.2,526117637.0,367784.0,,1974-02-02
Epitácio Pessoa,03/02/1974,98.3,526485420.0,367783.0,,1974-02-03
Epitácio Pessoa,04/02/1974,98.6,528324336.0,1838916.0,,1974-02-04
Epitácio Pessoa,05/02/1974,98.9,529611577.0,1287241.0,,1974-02-05
Epitácio Pessoa,06/02/1974,99.2,531450493.0,1838916.0,,1974-02-06
Epitácio Pessoa,07/02/1974,99.4,532553843.0,1103350.0,,1974-02-07
Epitácio Pessoa,08/02/1974,99.4,532553843.0,0.0,,1974-02-08
Epitácio Pessoa,09/02/1974,99.8,534576650.0,2022807.0,,1974-02-09
Epitácio Pessoa,10/02/1974,99.7,534208867.0,-367783.0,,1974-02-10
Epitácio Pessoa,11/02/1974,99.6,533657192.0,-551675.0,,1974-02-11
Epitácio Pessoa,12/02/1974,99.6,533473301.0,-183891.0,,1974-02-12
Epitácio Pessoa,13/02/1974,99.6,533473301.0,0.0,,1974-02-13
Epitácio Pessoa,14/02/1974,99.6,533473301.0,0.0,,1974-02-14
Epitácio Pessoa,15/02/1974,99.7,533841084.0,367783.0,,1974-02-15
Epitácio Pessoa,16/02/1974,99.7,534208867.0,367783.0,,1974-02-16
Epitácio Pessoa,17/02/1974,99.7,534208867.0,0.0,,1974-02-17
Epitácio Pessoa,18/02/1974,99.8,534576650.0,367783.0,,1974-02-18
Epitácio Pessoa,19/02/1974,99.8,534576650.0,0.0,,1974-02-19
Epitácio Pessoa,20/02/1974,99.8,534576650.0,0.0,,1974-02-20
Epitácio Pessoa,21/02/1974,99.9,535312217.0,735567.0,,1974-02-21
Epitácio Pessoa,22/02/1974,99.9,535312217.0,0.0,,1974-02-22
Epitácio Pessoa,23/02/1974,99.9,535128325.0,-183892.0,,1974-02-23
Epitácio Pessoa,24/02/1974,99.9,534944434.0,-183891.0,,1974-02-24
Epitácio Pessoa,25/02/1974,100.0,535680000.0,735566.0,,1974-02-25
Epitácio Pessoa,26/02/1974,100.0,535680000.0,0.0,,1974-02-26
Epitácio Pessoa,27/02/1974,99.2,531634385.0,-4045615.0,,1974-02-27
Epitácio Pessoa,28/02/1974,99.2,531266601.0,-367784.0,,1974-02-28
Epitácio Pessoa,01/03/1974,100.0,535680000.0,4413399.0,,1974-03-01
Epitácio Pessoa,02/03/1974,100.0,535680000.0,0.0,,1974-03-02
Epitácio Pessoa,03/03/1974,100.0,535680000.0,0.0,,1974-03-03
Epitácio Pessoa,04/03/1974,100.0,535680000.0,0.0,,1974-03-04
Epitácio Pessoa,05/03/1974,100.0,535680000.0,0.0,,1974-03-05
Epitácio Pessoa,06/03/1974,100.0,535680000.0,0.0,,1974-03-06
Epitácio Pessoa,07/03/1974,100.0,535680000.0,0.0,,1974-03-07
Epitácio Pessoa,08/03/1974,100.0,535680000.0,0.0,,1974-03-08
Epitácio Pessoa,09/03/1974,100.0,535680000.0,0.0,,1974-03-09
Epitácio Pessoa,10/03/1974,100.0,535680000.0,0.0,,1974-03-10
Epitácio Pessoa,11/03/1974,100.0,535680000.0,0.0,,1974-03-11
Epitácio Pessoa,12/03/1974,100.0,535680000.0,0.0,,1974-03-12
Epitácio Pessoa,13/03/1974,100.0,535680000.0,0.0,,1974-03-13
Epitácio Pessoa,14/03/1974,100.0,535680000.0,0.0,,1974-03-14
Epitácio Pessoa,15/03/1974,100.0,535680000.0,0.0,,1974-03-15
Epitácio Pessoa,16/03/1974,100.0,535680000.0,0.0,,1974-03-16
Epitácio Pessoa,17/03/1974,100.0,535680000.0,0.0,,1974-03-17
Epitácio Pessoa,18/03/1974,100.0,535680000.0,0.0,,1974-03-18
Epitácio Pessoa,19/03/1974,100.0,535680000.0,0.0,,1974-03-19
Epitácio Pessoa,20/03/1974,100.0,535680000.0,0.0,,1974-03-20
Epitácio Pessoa,21/03/1974,100.0,535680000.0,0.0,,1974-03-21
Epitácio Pessoa,22/03/1974,100.0,535680000.0,0.0,,1974-03-22
Epitácio Pessoa,23/03/1974,100.0,535680000.0,0.0,,1974-03-23
Epitácio Pessoa,24/03/1974,100.0,535680000.0,0.0,,1974-03-24
Epitácio Pessoa,25/03/1974,100.0,535680000.0,0.0,,1974-03-25
Epitácio Pessoa,26/03/1974,100.0,535680000.0,0.0,,1974-03-26
Epitácio Pessoa,27/03/1974,100.0,535680000.0,0.0,,1974-03-27
Epitácio Pessoa,28/03/1974,100.0,535680000.0,0.0,,1974-03-28
Epitácio Pessoa,29/03/1974,100.0,535680000.0,0.0,,1974-03-29
Epitácio Pessoa,30/03/1974,100.0,535680000.0,0.0,,1974-03-30
Epitácio Pessoa,31/03/1974,100.0,535680000.0,0.0,,1974-03-31
Epitácio Pessoa,01/04/1974,100.0,535680000.0,0.0,,1974-04-01
Epitácio Pessoa,02/04/1974,100.0,535680000.0,0.0,,1974-04-02
Epitácio Pessoa,03/04/1974,100.0,535680000.0,0.0,,1974-04-03
Epitácio Pessoa,04/04/1974,100.0,535680000.0,0.0,,1974-04-04
Epitácio Pessoa,05/04/1974,100.0,535680000.0,0.0,,1974-04-05
Epitácio Pessoa,06/04/1974,100.0,535680000.0,0.0,,1974-04-06
Epitácio Pessoa,07/04/1974,100.0,535680000.0,0.0,,1974-04-07
Epitácio Pessoa,08/04/1974,100.0,535680000.0,0.0,,1974-04-08
Epitácio Pessoa,09/04/1974,100.0,535680000.0,0.0,,1974-04-09
Epitácio Pessoa,10/04/1974,100.0,535680000.0,0.0,,1974-04-10
Epitácio Pessoa,11/04/1974,100.0,535680000.0,0.0,,1974-04-11
Epitácio Pessoa,12/04/1974,100.0,535680000.0,0.0,,1974-04-12
Epitácio Pessoa,13/04/1974,100.0,535680000.0,0.0,,1974-04-13
